post_id,page_id,page_name,title,description,post_type,duration_sec,publish_time,year,month,day,time,permalink,is_crosspost,is_share,funded_content_status,reach,shares,comments,reactions,seconds_viewed,average_seconds_viewed,impressions
3.0672E+14,1E+14,SUGARCANE,"""Sinehan"" Music Video Launch",,Text,0,9/12/2023 10:24,2023,9,12,10:24:00,https://www.facebook.com/events/306719668623365/,FALSE,FALSE,NaN,0,NaN,NaN,NaN,0,0,NaN
4.14347E+14,1E+14,SUGARCANE,"Happy birthday to our beloved drummer, Froilan! ??",,Photos,0,10/2/2021 7:58,2021,10,2,7:58:00,https://www.facebook.com/thesugarcaneph/posts/pfbid023gNcn7n2rP8GPtnbJr6SLjfB527rkmqk8x62FAJ3xbHPC5J2ih9mCrot3NTy9xocl,FALSE,FALSE,NaN,371,7,6,45,6,1,NaN
4.18E+14,1E+14,SUGARCANE,SUGARCANE added a new photo.,,Photos,0,10/8/2021 5:16,2021,10,8,5:16:00,https://www.facebook.com/photo.php?fbid=417999776353707&set=a.228682278618792&type=3,FALSE,FALSE,NaN,939,0,35,40,0,0,NaN
4.24828E+14,1E+14,SUGARCANE,Rainbow | ? South Border | SUGARCANE (Cover),Rainbow | ? South Border | SUGARCANE (Cover),Videos,311,10/18/2021 4:00,2021,10,18,4:00:00,https://www.facebook.com/thesugarcaneph/videos/275793317757450/,FALSE,FALSE,NaN,1161,1895,138,81,1522,0,NaN
4.3259E+14,1E+14,SUGARCANE,"Happy birthday to our beloved lead guitarist, Frain Reyes",,Photos,0,10/30/2021 6:59,2021,10,30,6:59:00,https://www.facebook.com/thesugarcaneph/posts/pfbid021HcNQMeocT1hV2HKxxyRxgRcdNuexfkggXkJ8URFVE17sHQKyWbxEjdT4CzBaxGl,FALSE,FALSE,NaN,467,3,12,38,2,1,NaN
4.70801E+14,1E+14,SUGARCANE,"Salamat sa walang sawang suporta! Hindi man kami nakapag release ng marami last year, grabe pa rin ang suporta na natanggap namin sa inyo. Babawi kami, marami pa kayong dapat abangan! Mahal na mahal namin kayo!! ??

Happy New Year! ??",,Photos,0,1/1/2022 4:18,2022,1,1,4:18:00,https://www.facebook.com/thesugarcaneph/posts/pfbid02f6j29jjeFbWABzComyV2M8u6A7FiQX9ihvKDkLFxhgKzbEqbqQYo6gdD492AZRuUl,FALSE,FALSE,NaN,625,0,88,22,0,0,NaN
5.5936E+14,1E+14,SUGARCANE,"Congratulations to the newly weds! ?? 

Sobrang nakakataba ng puso na makitang ang musika nami?y nagiging bahagi ng mga masasayang ala-ala tulad nito. Nakakakilig! ??

Stream our songs here: thesugarcaneph.biglink.to/platforms",,Videos,0,5/20/2022 4:27,2022,5,20,4:27:00,https://www.facebook.com/thesugarcaneph/posts/pfbid08iHxV55mpLqKKDzgcyK72Qoi66xGN7PCZFgMkakUFo1poZ9ccJYUZTE9thzxFYrnl,FALSE,TRUE,NaN,140,649,0,1,0,636,NaN
5.6207E+14,1E+14,SUGARCANE,Kasalanan ba kasing mahalin ka? ??,,Photos,0,5/24/2022 2:42,2022,5,24,2:42:00,https://www.facebook.com/thesugarcaneph/posts/pfbid02VQjGoaEK2CU3h4VG5vAVhhxkvc5ysSTXNhzgMabUg6MkcYBzDPYDDdYipMeppzYbl,FALSE,TRUE,NaN,306,0,31,5,0,0,NaN
5.77569E+14,1E+14,SUGARCANE,"Thank you Warner Family! ??

We are happy to announce that we are now part of Warner Music Philippines.

We are very grateful to all of you for the unending love and support. 

Together with Warner, expect that this is just the start - more are yet to come.

Papunta pa lang tayo sa exciting part! ??

Thank you sir Kelley Mangahas, sir Rem Brofar, and to the rest of the Warner team for making this all possible. 

------ 

3 Weeks left for our next single, July 8, 2022!

Pre-save here: https://sugarcane.lnk.to/presaveparuparo

#SalamatWarner",,Photos,0,6/17/2022 4:00,2022,6,17,4:00:00,https://www.facebook.com/thesugarcaneph/posts/pfbid05MgTm9nVJSxW2AF2S9SyEEiKcHMFhV6T5XLxcEjRYHcW2CS96vuoCm8sFLQxBSb3l,FALSE,FALSE,NaN,1409,20,170,92,0,6,NaN
5.80487E+14,1E+14,SUGARCANE,"Happy birthday sa pinakamagandang babae sa SUGARCANE, Ronamae Ti?ola!! ??",,Photos,0,6/20/2022 4:09,2022,6,20,4:09:00,https://www.facebook.com/thesugarcaneph/posts/pfbid02dsxSfB2aq2fvxztUtFSHNmwBmC1uJbpGRw5K66Wk577Jvde6HXzgm5hZxE58kgPel,FALSE,FALSE,NaN,599,0,15,64,0,0,NaN
5.86666E+14,1E+14,SUGARCANE,"PRE-SAVE NOW: https://sugarcane.lnk.to/presaveparuparo

Out on all digital platforms on July 8, 2022 at 12 am!! ??

???? 
?Paruparo? is a song that mainly revolves around the concept of destiny; as it gives a more profound meaning to the famous saying, ?if it?s meant to be, it will be.? 

In this song, SUGARCANE in collaboration with an up-and-coming artist, JC Herrero, has once more utilized one of their strengths in songwriting - a captivating melody partnered with relatable lyrics for all ages in a storytelling manner.

Artwork by Felix Gasmen.",,Photos,0,6/29/2022 4:00,2022,6,29,4:00:00,https://www.facebook.com/thesugarcaneph/posts/pfbid0A3HZMxAtKG1yjRPgkBNScbPSuPCkwHBWJs1gLp19zSCMP133XwP966SoGWiwvU79l,FALSE,FALSE,NaN,691,0,124,37,0,0,NaN
5.88239E+14,1E+14,SUGARCANE,SUGARCANE - Paruparo (TEASER),"PRE-SAVE NOW: https://sugarcane.lnk.to/presaveparuparo

Out on all digital platforms on July 8, 2022 at 12 am!! ??",Videos,36,7/1/2022 3:05,2022,7,1,3:05:00,https://www.facebook.com/reel/708434383581241/,FALSE,FALSE,NaN,1354,1671,203,64,0,1449,NaN
5.89907E+14,1E+14,SUGARCANE,"Congratulations sa mga newly grads!! ??

Fun fact: ?Gunita? was initially intended to be a high school graduation song, kaya highlight talaga ng song ang memories ng isang buhay estudyante. 

Feel free to use the sound as background music for your high school/college life montages, and tag us on our social media platforms, @thesugarcaneph.

Follow niyo na rin kami sa Tiktok! ??

https://vt.tiktok.com/ZSdohNMo6/

Pre-save our latest single: https://sugarcane.lnk.to/presaveparuparo","Congratulations sa mga newly grads!! ??

Fun fact: ?Gunita? was initially intended to be a high school graduation song, kaya highlight talaga ng song ang memories ng isang buhay estudyante. 

Feel free to use the sound as background music for your high school/college life montages, and tag us on our social media platforms, @thesugarcaneph.

Follow niyo na rin kami sa Tiktok! ??

https://vt.tiktok.com/ZSdohNMo6/

Pre-save our latest single: https://sugarcane.lnk.to/presaveparuparo",Videos,64,7/3/2022 6:46,2022,7,3,6:46:00,https://www.facebook.com/reel/778331813609377/,FALSE,FALSE,NaN,1049,1393,132,27,0,116241.04,NaN
5.9038E+14,1E+14,SUGARCANE,"Happy birthday to our bassist and vocalist, Carl Guerzon!! ????",,Photos,0,7/4/2022 0:56,2022,7,4,0:56:00,https://www.facebook.com/thesugarcaneph/posts/pfbid0GxrPNPyHmiLDXT8A6ytbLPeZJ3K373ztvxjBeUvEeYuyxK4gFX5obNKNbqeVGprVl,FALSE,FALSE,NaN,818,1,32,96,0,0,NaN
5.90488E+14,1E+14,SUGARCANE,"Meet Froilan, our drummer.
The man behind the heartwarming lyrics of ?Gunita? and ?Dalangin?. ??

Pre-save ?Paruparo? through the link: https://sugarcane.lnk.to/presaveparuparo",,Photos,0,7/4/2022 5:00,2022,7,4,5:00:00,https://www.facebook.com/thesugarcaneph/posts/pfbid0244m8FfVqAdikiZsAWE8qUuRTU9ZNasbYAKLFUEnWFMPzJatejKgv4mRihKVGJFrDl,FALSE,FALSE,NaN,236,0,33,7,0,0,NaN
5.91032E+14,1E+14,SUGARCANE,"Hi Fam! May Discord server na kami. ?

Discord Link: https://discord.gg/KNsp8TbMZK

Our discord server is now open for anyone who wants to hang out with us, and with the rest of the SUGARCANE community. 

Laro tayo minsan kung anong trip niyong laruin or kaya naman kahit Netflix and Chill lang. 

Pre-save our latest single: https://sugarcane.lnk.to/presaveparuparo ??",,Photos,0,7/5/2022 2:00,2022,7,5,2:00:00,https://www.facebook.com/thesugarcaneph/posts/pfbid0jccS9irG5En4Yi4pBHQR9YFVERGvbsSHZsxf73Lt38Uu4kpSJbZC3nsdtuKSn5M3l,FALSE,FALSE,NaN,407,2,28,13,0,0,NaN
5.91109E+14,1E+14,SUGARCANE,"Meet Rona, our flutist.
Considered as the most fashionable among all members of the band. ??

Pre-save ?Paruparo? through the link: https://sugarcane.lnk.to/presaveparuparo",,Photos,0,7/5/2022 5:00,2022,7,5,5:00:00,https://www.facebook.com/thesugarcaneph/posts/pfbid0cWEYgSyGYuSzGbVe7ZAYyfdBh3QMj9LTBtRKndJ5zY2krDChSacXjmhyy17yo1e4l,FALSE,FALSE,NaN,239,1,24,3,0,0,NaN
5.91667E+14,1E+14,SUGARCANE,PRE-SAVE: https://sugarcane.lnk.to/presaveparuparo ??,,Photos,0,7/6/2022 3:08,2022,7,6,3:08:00,https://www.facebook.com/photo.php?fbid=591666502320366&set=a.228682271952126&type=3,FALSE,FALSE,NaN,215,0,14,4,0,0,NaN
5.91746E+14,1E+14,SUGARCANE,"Meet Luis, our keyboardist.
The youngest yet the tallest among the band. ??

Pre-save our latest single ?Paruparo? through the link: https://sugarcane.lnk.to/presaveparuparo",,Photos,0,7/6/2022 5:51,2022,7,6,5:51:00,https://www.facebook.com/thesugarcaneph/posts/pfbid02cfdE8eyixZav849MSRYrNbGpGrjfuAyY9yJuMqMq4n7EmANH9oB6Y9N8FAHXk9cZl,FALSE,FALSE,NaN,207,0,18,4,0,0,NaN
5.92119E+14,1E+14,SUGARCANE,"Meet Frain, our lead guitarist. 
Also the most athletic among the band. ??

Pre-save ?Paruparo? through the link: https://sugarcane.lnk.to/presaveparuparo",,Photos,0,7/6/2022 19:00,2022,7,6,19:00:00,https://www.facebook.com/thesugarcaneph/posts/pfbid0VBxFvKTwg8MwJ7co79AQoSyj6L1NJ3PXWSGLxPx5migmBnQ5Cegryuk5DHPTfzPFl,FALSE,FALSE,NaN,254,0,23,8,0,0,NaN
5.9238E+14,1E+14,SUGARCANE,"Meet Carl, our vocalist and bassist. 
Eldest among the band with the biggest heart for pets. ??

Pre-save our latest single ""Paruparo"": https://sugarcane.lnk.to/presaveparuparo",,Photos,0,7/7/2022 5:00,2022,7,7,5:00:00,https://www.facebook.com/thesugarcaneph/posts/pfbid0NvcPtopf9jmV6x1F8FUZa81fbJyx8AFcJ6YrhGjheH1VctYvW7WSgyZftKKD5PHil,FALSE,FALSE,NaN,285,0,25,9,0,0,NaN
5.92477E+14,1E+14,SUGARCANE,"Meet Cedric, our vocalist and guitarist. 
Aside from his talents in singing, he also has an astonishing perfect pitch. ??

Pre-save ""Paruparo"": https://sugarcane.lnk.to/presaveparuparo",,Photos,0,7/7/2022 8:00,2022,7,7,8:00:00,https://www.facebook.com/thesugarcaneph/posts/pfbid092y6wj9EZyChgoKTwmnaPaT3U1UbqnYAobmjdAZp2gGSyHo8kYwrjHbyKwTD4FG9l,FALSE,FALSE,NaN,271,0,19,19,0,0,NaN
5.92508E+14,1E+14,SUGARCANE,"""PARUPARO"" OUT NOW! STREAM HERE:
https://sugarcane.lnk.to/paruparo

?Paruparo? is a song that mainly revolves around the concept of destiny; as it gives a more profound meaning for the famous saying, ?if it?s meant to be, it will be.? 

In this song, SUGARCANE in collaboration with an up-and-coming artist, JC Herrero, has once more utilized one of their strengths in songwriting - a captivating melody partnered with relatable lyrics for all ages in a storytelling manner.

Credits:
Lyricist: JC Herrero
Composer: James Lee, Cedric Angeles
Recorded by: Peavey Nicolas of Big Baby Studios
Producer: Jazz Nicolas of The Itchyworms
Mixing Engineer: Jorel Corpus
Mastering Engineer: Jett Galindo of The Bakery L.A.
Art by: Felix Gasmen

Warner Music Philippines: 
Sarah Ismail
Kelley Mangahas 
Rem Brofar 
Jam Rances
Nicole De Jesus",,Photos,0,7/7/2022 9:00,2022,7,7,9:00:00,https://www.facebook.com/thesugarcaneph/posts/pfbid042aW4qJW2uHmtSwCXkBkJKjZCzFUeJ61ACntAwwMsRRbu2hWB51qHdNnCCQWq3bCl,FALSE,FALSE,NaN,831,1,184,26,0,0,NaN
5.92509E+14,1E+14,SUGARCANE,"STREAM ""????????????????"" HERE:
https://sugarcane.lnk.to/paruparo

JOIN OUR FAMILY:

FB Group: https://facebook.com/groups/sugarcanefamily

Discord Server: https://tinyurl.com/thesugarcaneph-discord",,Photos,0,7/7/2022 9:01,2022,7,7,9:01:00,https://www.facebook.com/photo.php?fbid=592508828902800&set=a.228682278618792&type=3,FALSE,FALSE,NaN,1094,0,57,30,0,0,NaN
5.93784E+14,1E+14,SUGARCANE,"Thank you Warner Music Philippines! ??

Stream ?Paruparo?: sugarcane.lnk.to/paruparo",,Videos,0,7/9/2022 4:00,2022,7,9,4:00:00,https://www.facebook.com/thesugarcaneph/posts/pfbid02wNX4MC9yDts7kr3tkd3q629DubmVRfUf3nLrocsRkrs4VhckQjzs7cosrH2Nx5i5l,FALSE,TRUE,NaN,231,329,0,2,0,0,NaN
5.94314E+14,1E+14,SUGARCANE,"Grabe kayo 10k total plays na agad ""Paruparo"" mula nung ni-release namin 2 days ago sa YouTube at Spotify. ??

Thank you for the heart-warming support on our latest single! ??

CONTINUE STREAMING HERE: sugarcane.lnk.to/paruparo",,Photos,0,7/9/2022 21:00,2022,7,9,21:00:00,https://www.facebook.com/thesugarcaneph/posts/pfbid021YCfxvHP8oaXF9qGvFiJLi7Ern3TQ7Dc3a8RYjLx2FtFA739vkv5G223vFryToucl,FALSE,FALSE,NaN,643,1,42,38,0,0,NaN
5.9518E+14,1E+14,SUGARCANE,"?Paruparo? MV Teaser | Out on July 16, 8PM.   Stream here: sugarcane.lnk.to/paruparo","SUGARCANE?s first ever Music Video will be out on July 16, 8PM ??

Stream ?Paruparo? here: sugarcane.lnk.to/paruparo",Videos,16,7/11/2022 5:00,2022,7,11,5:00:00,https://www.facebook.com/reel/1150002458911140/,FALSE,FALSE,NaN,2426,3775,306,93,0,239058.2,NaN
5.96547E+14,1E+14,SUGARCANE,"Mark your calendars! 

Official Music Video of ?Paruparo? will be out on the 16th. ??

Stream here: sugarcane.lnk.to/paruparo",,Photos,0,7/13/2022 5:00,2022,7,13,5:00:00,https://www.facebook.com/thesugarcaneph/posts/pfbid0PXELF45DSZEjcefPsQduSExpLgNHH2k1QySMaMtjKwq5Xf81pL13JmCyYRGm3APsl,FALSE,FALSE,NaN,316,0,32,8,0,0,NaN
5.97219E+14,1E+14,SUGARCANE,"Handa na ba ang lahat? 

Dalawang tulog na lang at matutunghayan na natin ang Music Video ng ?Paruparo"". ??

A film by Chapters.

Stream here: sugarcane.lnk.to/paruparo",,Photos,0,7/14/2022 4:00,2022,7,14,4:00:00,https://www.facebook.com/thesugarcaneph/posts/pfbid02T4SD4eKaRDAi3Z1xhTvXRjh4s6EJk7PhNjbL18WMghM826R2ttquuqYKFdrUZ2j5l,FALSE,FALSE,NaN,287,0,17,10,0,0,NaN
5.97901E+14,1E+14,SUGARCANE,"Join us tomorrow, July 16, in our live countdown for Paruparo?s Music Video release on Facebook and YouTube. SUGARCANE, along with JC Herrero, will serenade you with some songs while waiting.

Live countdown will start at exactly 7PM! See you! ??

Stream here: sugarcane.lnk.to/paruparo",,Photos,0,7/15/2022 0:28,2022,7,15,0:28:00,https://www.facebook.com/thesugarcaneph/posts/pfbid02AzKxG7JEdAYJw5RHyxGwitMUHtVkQPr2Mxcm8Tw7288WhsYA389EKqxRLYoXTkNPl,FALSE,FALSE,NaN,424,1,31,5,0,0,NaN
5.98035E+14,1E+14,SUGARCANE,"This is it ??

Mapapanood na bukas ng 8PM sa aming YouTube channel ang kauna-unahang music video ng SUGARCANE. Don?t miss this out! 

Starring Yskaela Fujimoto and... ??

Stream ?Paruparo? here: sugarcane.lnk.to/paruparo",,Photos,0,7/15/2022 5:00,2022,7,15,5:00:00,https://www.facebook.com/thesugarcaneph/posts/pfbid0GG1NmN4UijFCk3g4X9MwUdA7j1d2EUTMLs6ZNXj5avSm6jUoGQFcFKvC9fX46grAl,FALSE,FALSE,NaN,486,0,46,12,0,0,NaN
5.98535E+14,1E+14,SUGARCANE,"Alam naming may matagal ka nang napupusuan pero ?di mo lang maamin. Hayaan mo, kami na bahala.

Tag niyo sa comments section ang inyong ?Paruparo? or special someone that you would want to confess your feelings to, and if they reply, flowers are on us! ????

?Wag mo nang palampasin ?to, umamin na ang aamin!!! 

??

Follow the mechanics that can be seen in the photo and in the comments, and get a chance to be one of the five (5) lucky winners of our flower giveaway. 

Contest runs from July 16 - July 29. 
Winners will be announced by 2nd week of August.",,Photos,0,7/15/2022 22:00,2022,7,15,22:00:00,https://www.facebook.com/thesugarcaneph/posts/pfbid02w4HDz7UWLuS3ULieUeqLcg2ixcqk8VAs86iiDEDJiKWZkSBQUpS6xt86k2U9ia2Cl,FALSE,FALSE,NaN,731,10,49,241,0,0,NaN
5.9875E+14,1E+14,SUGARCANE,"?Paruparo? Official Music Video
Watch here: https://youtu.be/MrDnh6CACCk

Our first ever Music Video is now out on our YouTube channel. ??

Starring Yskaela Fujimoto & Xai Smith. 

We would like to thank the following:

Video Production by Chapters PH
Director - Carl Tejada
Asst Director & EP - Andromeda Tan
Creative Producer - Jonina Ramos
Videographers - Karlo Calingao & Jeff Oabel
Video Editor - Julius Villavieja
Photographer - Louis Duran
PM - Kyla A?el
Asst PM - Patricia Corpus
PA - Anthony Dy & Roger 
Drivers - Jay Panti & Jessie Felicia

Special thanks to Mr. Matt Nicolai, Cinejepoy, & 
Villa Severina Bed & Breakfast

Credits:
Lyricist: JC Herrero
Composer: James Lee, Cedric Angeles
Recorded by: Peavey Nicolas of Big Baby Studios
Producer: Jazz Nicolas of The Itchyworms
Mixing Engineer: Jorel Corpus
Mastering Engineer: Jett Galindo of The Bakery L.A.
Art by: Felix Gasmen

Warner Music Philippines: 
Sarah Ismail
Kelley Mangahas 
Rem Brofar 
Jam Rances
Nicole De Jesus","?Paruparo? Official Music Video
Watch here: https://youtu.be/MrDnh6CACCk

Our first ever Music Video is now out on our YouTube channel. ??

Starring Yskaela Fujimoto & Xai Smith. 

We would like to thank the following:

Video Production by Chapters PH
Director - Carl Tejada
Asst Director & EP - Andromeda Tan
Creative Producer - Jonina Ramos
Videographers - Karlo Calingao & Jeff Oabel
Video Editor - Julius Villavieja
Photographer - Louis Duran
PM - Kyla A?el
Asst PM - Patricia Corpus
PA - Anthony Dy & Roger 
Drivers - Jay Panti & Jessie Felicia

Special thanks to Mr. Matt Nicolai, Cinejepoy, & 
Villa Severina Bed & Breakfast

Credits:
Lyricist: JC Herrero
Composer: James Lee, Cedric Angeles
Recorded by: Peavey Nicolas of Big Baby Studios
Producer: Jazz Nicolas of The Itchyworms
Mixing Engineer: Jorel Corpus
Mastering Engineer: Jett Galindo of The Bakery L.A.
Art by: Felix Gasmen

Warner Music Philippines: 
Sarah Ismail
Kelley Mangahas 
Rem Brofar 
Jam Rances
Nicole De Jesus",Videos,15,7/16/2022 5:03,2022,7,16,5:03:00,https://www.facebook.com/reel/367675452178009/,FALSE,FALSE,NaN,6514,6124,429,160,0.02,599583.61,NaN
5.99358E+14,1E+14,SUGARCANE,"?Paruparo? (Official Music Video) out now on our YouTube channel. ??

Watch here: https://tinyurl.com/paruparomv

Shot by Louis Duran.",,Photos,0,7/17/2022 3:00,2022,7,17,3:00:00,https://www.facebook.com/thesugarcaneph/posts/pfbid035FtdXxz7EUCFcDrgV46MN4Q4kNGxeqfooMJLXnHk7FXcCUcyziqXdEa75oP8DBmyl,FALSE,FALSE,NaN,472,0,60,5,0,0,NaN
5.9946E+14,1E+14,SUGARCANE,Love Team by Itchyworms - Performed by SUGARCANE with Mr. Jazz Nicolas,"Love Team by Itchyworms - Performed by SUGARCANE with Mr. Jazz Nicolas  

It was a dream come true for us to have been given the chance to work with one of our childhood heroes in the music scene. It was an exceptional experience to have Mr. Jazz Nicolas of the Itchyworms, produce our latest single, ""Paruparo"". ??

Stream here: sugarcane.lnk.to/paruparo
Watch here: https://youtu.be/MrDnh6CACCk",Videos,100,7/25/2022 4:00,2022,7,25,4:00:00,https://www.facebook.com/reel/349132864057905/,FALSE,FALSE,NaN,360,551,26,10,0,49829.71,NaN
6.00214E+14,1E+14,SUGARCANE,"Behind the scene photos of ""Paruparo"" MV. ??

Shots by Louis Duran.",,Photos,0,7/18/2022 4:00,2022,7,18,4:00:00,https://www.facebook.com/thesugarcaneph/posts/pfbid0wpBdLon4yn4wseTNN1aj873M5Tk5TswYv7Wc8XkvsNJRzvYr1RiUSqe7eQxob68tl,FALSE,FALSE,NaN,653,0,49,16,0,0,NaN
6.00949E+14,1E+14,SUGARCANE,"Catch us this July 21st at Mow's. 

We are thrilled to share the stage with Jensen Gomez, Purples n' Oranges, Along The Alps, and Nate. 

Kita kits tayo doon! ?",,Photos,0,7/19/2022 4:00,2022,7,19,4:00:00,https://www.facebook.com/thesugarcaneph/posts/pfbid02MxoZp2FfKY7gWiCkZJQviA724CpRmE2iUWUfYpAWzinnEEjAQV2oxiyyedu91Y9rl,FALSE,FALSE,NaN,180,0,15,4,0,0,NaN
6.01013E+14,1E+14,SUGARCANE,"Thank you so much Warner! ????

Watch here: wmp.lnk.to/ParuParoMV",,Videos,0,7/19/2022 6:16,2022,7,19,6:16:00,https://www.facebook.com/thesugarcaneph/posts/pfbid02A7SDsfbFzzdg2pfMABopGerEXH4oTjnTfR79HwdyaEhmqQScyoNKtEgmK5bJc3h7l,FALSE,TRUE,NaN,200,449,0,0,0,0,NaN
6.01635E+14,1E+14,SUGARCANE,"Guitar Playthrough with Chords

Watch here: https://youtu.be/uT7VxKrKTi0

Sa mga nagrerequest ng chords at guitar tutorial for our latest single, ""Paruparo"", we got you! ??

Tag us on our social media accounts @thesugarcaneph, with your guitar cover of our songs and use the hashtag #SugarcanTahan","Guitar Playthrough with Chords

Watch here: https://youtu.be/uT7VxKrKTi0

Sa mga nagrerequest ng chords at guitar tutorial for our latest single, ""Paruparo"", we got you! ??

Tag us on our social media accounts @thesugarcaneph, with your guitar cover of our songs and use the hashtag #SugarcanTahan",Videos,15,7/20/2022 5:00,2022,7,20,5:00:00,https://www.facebook.com/reel/452963006385315/,FALSE,FALSE,NaN,235,276,21,5,0,19419.88,NaN
6.02275E+14,1E+14,SUGARCANE,"Watch the BTS of ?Paruparo? Music Video in Xai Smith & Yaena Fujimoto?s POV ??

Watch here: youtu.be/VU4Y9iiOe0I

Don?t forget to subscribe to their YouTube channels as well!

???

? Watch the Official MV here: wmp.lnk.to/paruparomv
? Subscribe to Xai's Channel: bit.ly/3RGQ51v
? Subscribe to Yskaela' Channel: youtube.com/YaenaYskaelaFujimoto",,Photos,0,7/21/2022 4:00,2022,7,21,4:00:00,https://www.facebook.com/thesugarcaneph/posts/pfbid02dgi2EJHoCxcs6YeiyddUtMVH5BXeVD8tozGWBbKTz74KpCD7F1epDSy92BZXyroYl,FALSE,FALSE,NaN,149,0,11,0,0,0,NaN
6.02955E+14,1E+14,SUGARCANE,"Gig at Mow's last night ????

Maraming salamat sa lahat ng pumunta at nanood kagabi. 

Thank you din sa lahat ng mga kasama namin last night. Sobrang solid niyo Jensen Gomez , Nate, Purples n' Oranges, & Along The Alps!

??: Rachel Tilos",,Photos,0,7/22/2022 5:05,2022,7,22,5:05:00,https://www.facebook.com/thesugarcaneph/posts/pfbid02fdCEX3ffRfMyp5uv6gCK4JoCe5GDQtBKGLLPZeqHtjM4FJn19RqHTx6JjuQbgGWil,FALSE,FALSE,NaN,310,1,17,0,0,0,NaN
6.03419E+14,1E+14,SUGARCANE,SUGARCANE - Kung Maging Akin Ka | Live at Mow's,"?? Mow's | 7.21.22

Kung Maging Akin Ka by SUGARCANE 

Stream our songs here: http://thesugarcaneph.biglink.to/platforms",Videos,250,7/22/2022 21:00,2022,7,22,21:00:00,https://www.facebook.com/reel/838083247109475/,FALSE,FALSE,NaN,1818,3732,213,168,0,671131.68,NaN
6.03652E+14,1E+14,SUGARCANE,"?Paruparo? Instrumental/Karaoke is now out on our YouTube channel. 

Watch here: https://youtu.be/EBqRQKbJA9g

Can?t wait to hear your cover of our latest single. ??

Tag us on our social media accounts @thesugarcaneph, with your cover of our songs and use the hashtag: #SugarcanTahan","?Paruparo? Instrumental/Karaoke is now out on our YouTube channel. 

Watch here: https://youtu.be/EBqRQKbJA9g

Can?t wait to hear your cover of our latest single. ??

Tag us on our social media accounts @thesugarcaneph, with your cover of our songs and use the hashtag: #SugarcanTahan",Videos,25,7/23/2022 5:00,2022,7,23,5:00:00,https://www.facebook.com/reel/545679147240524/,FALSE,FALSE,NaN,149,184,8,4,0,10087.42,NaN
6.04306E+14,1E+14,SUGARCANE,"?Paruparo?, our first single under a record label, will always have a special place in our hearts. ??

We are beyond grateful for the people behind this project that made our dreams come into reality. 

We would like to thank everyone that made this possible ? from the recording process up to the music video production. Mahal na mahal namin kayo! 

Warner Music Philippines: 
Sarah Ismail
Kelley Mangahas 
Rem Brofar 
Jam Rances
Nicole De Jesus
Neil Dimapilis
Nika Evangelista

Production:
Producer: Jazz Nicolas, Peavey Nicolas
Mixing: Jorel Corpuz
Mastering: Jett Galindo of The Bakery L.A.
Lyricist: JC Herrero
Composer: James Lee, Cedric Angeles

Art:
Single Cover: Felix Gasmen 
Publication Materials: Rem Brofar 

Photoshoot:
Photographer: Dix Perez
Hair Stylist: Patty Inojales
Stylist: Jana Silao & Sophie Silao
Makeup Artist: Xeng Zulueta

Video Production by Chapters PH

Artist and Manager:
Female Lead: Yskaela Fujimito
Male Lead: Xai Smith
Influencer Manager: Matt Nicolai

Director - Carl Tejada
Asst Director & EP - Andromeda Tan
Creative Producer - Jonina Ramos
Videographers - Karlo Calingao & Jeff Oabel
Video Editor - Julius Villavieja
Photographer - Louis Duran
PM - Kyla A?el
Asst PM - Patricia Corpus
PA - Anthony Dy & Roger 
Drivers - Jay Panti & Jessie Felicia

Music Video:
Hair Stylists: Jannele Dela Cruz, Riri Wu
Make-up Artist: Eugene Tiongson
Stylist: Jones Palteng

Special thanks to: 
Cinejepoy
Villa Severina Bed & Breakfast
SUGARCANE Family
Wooderna
Stephen Lacza
Ron Andres 

Stream and watch here: sugarcane.lnk.to/paruparo",,Photos,0,7/24/2022 5:00,2022,7,24,5:00:00,https://www.facebook.com/thesugarcaneph/posts/pfbid02cSJTRvuDhLdZSBg4JaEHJCrhYchsaHmSzaPiVz2L9UC6935EBEEWtmTHEcpaCna5l,FALSE,FALSE,NaN,497,4,47,20,0,0,NaN
6.05469E+14,1E+14,SUGARCANE,SUGARCANE Live at ASAP Natin 'To - Part 1,"Bakit nga ba ?SUGARCANE?? 

Follow us on Tiktok and watch the full video of Carl and Cedric?s ASAP guesting to know the reason why. 

Watch here: https://vt.tiktok.com/ZSRFuGkWy/?k=1",Videos,16,7/26/2022 4:00,2022,7,26,4:00:00,https://www.facebook.com/reel/377182844529481/,FALSE,FALSE,NaN,865,1620,61,22,0,85773.85,NaN
6.06091E+14,1E+14,SUGARCANE,SUGARCANE Live at ASAP Natin 'To - Part 2,"Yakap sa Dilim - Performed by SUGARCANE at ASAP Natin 'To 

Watch here: https://vt.tiktok.com/ZSRFKdSN7/?k=1

Follow us on Tiktok and watch the full video of Carl and Cedric?s rendition of ""Yakap sa Dilim"" together with Erik Santos, JM De Guzman, Darryl Ong, Jason Dy, and I?igo Pascual.

#Throwback",Videos,30,7/27/2022 4:00,2022,7,27,4:00:00,https://www.facebook.com/reel/1185960561969414/,FALSE,FALSE,NaN,1071,1454,49,26,0,104047.59,NaN
6.0672E+14,1E+14,SUGARCANE,"It still feels surreal to have Yskaela Fujimoto and Xai Smith fulfill the starring role for our first ever music video. ??

Photo by: Louis Duran

Watch here: https://youtu.be/MrDnh6CACCk",,Photos,0,7/28/2022 4:00,2022,7,28,4:00:00,https://www.facebook.com/thesugarcaneph/posts/pfbid02omrcjRoMFZHtz1zsyevPTGAPuc4w117wTEmMiQishUGvjW8vQwNC9XBpdtnoMWsWl,FALSE,FALSE,NaN,387,0,38,6,0,0,NaN
6.07404E+14,1E+14,SUGARCANE,Ayeee! ????,,Text,0,7/29/2022 5:05,2022,7,29,5:05:00,https://www.facebook.com/thesugarcaneph/posts/pfbid02vid55dd5EouqBpnRrYsZUT78FR64nKAqUmUR7EmS67rEz6bCMZn8TL9rHTBfQYbYl,FALSE,FALSE,NaN,121,0,2,1,0,0,NaN
6.07999E+14,1E+14,SUGARCANE,"Appreciation post for these amazing artworks!

Sobrang heartwarming lahat ng 'to! We are beyond grateful, and we really appreciate your efforts. ????

Stream our latest single, ""Paruparo"", here: https://sugarcane.lnk.to/paruparo",,Photos,0,7/30/2022 4:00,2022,7,30,4:00:00,https://www.facebook.com/thesugarcaneph/posts/pfbid0Awbdj2gw1Bp5b2mD6SNUPZUWJR4a8gKmsccbXgLyH2C7HX4EL8Pf8ierK67AvTRCl,FALSE,FALSE,NaN,341,3,47,1,0,0,NaN
6.08665E+14,1E+14,SUGARCANE,????,,Text,0,7/31/2022 5:30,2022,7,31,5:30:00,https://www.facebook.com/thesugarcaneph/posts/pfbid02BFqPBeq8cV8MYRdw8mEXVH4cyiPb69fBWZKknbvvZJgNLb6ht97bEpgSD5W5CYPUl,FALSE,TRUE,NaN,102,108,0,3,0,0,NaN
6.09181E+14,1E+14,SUGARCANE,Paruparo | Frain Reyes' Lead Playthrough with Tabs,"""Paruparo"" Lead Guitar Playthrough with Tabs 

??: https://youtu.be/oTr3uOMrZQo

Watch Frain Reyes' step-by-step guide on our latest single's lead guitar section. ??

Tag us on our social media accounts @thesugarcaneph, with your guitar cover of our songs and use the hashtag #SugarcanTahan",Videos,18,8/1/2022 4:58,2022,8,1,4:58:00,https://www.facebook.com/reel/445258417614814/,FALSE,FALSE,NaN,241,286,24,4,0,19199.83,NaN
6.09953E+14,1E+14,SUGARCANE,??,,Videos,0,8/2/2022 5:12,2022,8,2,5:12:00,https://www.facebook.com/thesugarcaneph/posts/pfbid02FXXKPJZz9uMeVf5ndT6P5XkyeDhcbvnLLFGLYqqSgK2eAAHLpb7SExPDBWzJfh4dl,FALSE,TRUE,NaN,230,411,0,1,0,0,NaN
6.10546E+14,1E+14,SUGARCANE,,,Text,0,8/3/2022 5:10,2022,8,3,5:10:00,https://www.facebook.com/thesugarcaneph/posts/pfbid0382yXjfaajty4ECa2ngvZycWZuvYu9gkB77gtcPi8YwWZRVxiFZRcRLREmrwfm5JRl,FALSE,TRUE,NaN,89,164,0,0,0,0,NaN
6.11192E+14,1E+14,SUGARCANE,"Happy birthday to our keyboardist, Luis Beato!! ????",,Photos,0,8/4/2022 4:30,2022,8,4,4:30:00,https://www.facebook.com/thesugarcaneph/posts/pfbid09PwGSe3xp8aRcRs75Zztiaams1dAqotCLfPqmj98dJwH9t31bCwPJCFVgzDgoWFUl,FALSE,FALSE,NaN,633,1,8,83,0,0,NaN
6.11654E+14,1E+14,SUGARCANE,SUGARCANE's Video,,Photos,58,8/5/2022 4:00,2022,8,5,4:00:00,https://www.facebook.com/thesugarcaneph/posts/pfbid0oW2CG2d6EGmkk7yAAFF4MEScvd5B7xm97p2q3hENxRnWDe5EhM8qXXJMyhQLCorkl,FALSE,FALSE,NaN,312,2,20,3,0,0,NaN
6.12522E+14,1E+14,SUGARCANE,"Happy birthday to our vocalist and guitarist, Cedric Angeles!! ????",,Photos,0,8/6/2022 4:30,2022,8,6,4:30:00,https://www.facebook.com/thesugarcaneph/posts/pfbid0XJVBzUdyTyTWo7cGwjcCZUC2r9mBdCepMXPza8JnvZHm6QEduaxtWzDcwjuQUwwMl,FALSE,FALSE,NaN,591,1,13,91,0,0,NaN
6.13238E+14,1E+14,SUGARCANE,"Join us this August 13, 2022 at saGuijo Cafe + Bar Events, for Think Things Through Vol. 9!

We will be sharing the stage with Leanne & Naara, Basically Saturday Night, Jensen Gomez, No Lore, & Aster The Band. 

Gates open at 7pm! Get your early bird tickets through the link below: 
https://bit.ly/TTTVol9

Kitakits! Excited kaming makita at makasama kayo. ?",,Photos,0,8/7/2022 4:00,2022,8,7,4:00:00,https://www.facebook.com/thesugarcaneph/posts/pfbid02LJhUwg5zMgryTHEYQqi5sqpvdrQ1QzYSm35GoCzZgrrvDV76y5rEbwKo6CCEY6Wbl,FALSE,FALSE,NaN,136,0,17,4,0,0,NaN
6.13882E+14,1E+14,SUGARCANE,"Congratulations to the winners of SUGARCANE's ""Say It with Flowers"" giveaway contest!

Sobrang daming entrees, kaya kinailangan pa naming mag-roleta for the final 5 winners. Hindi man pinalad ang ibang nag confess, hanga kami sa tapang niyo, at sigurado kaming hindi sayang ang pag-amin niyo. ?

For the winners, kindly send us a message in our FB page with the following details: 
Winner's Mobile Number: 
Recipient Mobile Number: 
Recipient's Address:",,Photos,0,8/8/2022 4:00,2022,8,8,4:00:00,https://www.facebook.com/thesugarcaneph/posts/pfbid0cCS6ieb74sFqdRHpZCitdRyb4FDBpSgX4HzG22zwTNiobpLCfvtb6z9Hjn38TihUl,FALSE,FALSE,NaN,176,0,12,14,0,0,NaN
6.14489E+14,1E+14,SUGARCANE,"Paruparo Music Video has reached 100k+ views on YouTube in less than a month!

Congratulations and thank you to the whole team behind the MV: 
Chapters 
Warner Music Philippines 
Yaena Fujimoto 
Xai Smith 
JC Herrero 

We are beyond grateful for all the love and support. ??

Continue to watch and stream here: sugarcane.lnk.to/paruparo",,Photos,0,8/9/2022 4:00,2022,8,9,4:00:00,https://www.facebook.com/thesugarcaneph/posts/pfbid0QG9h7wKk8XegjKEt3taDHdt4r7csmDXWf1BEFAxXfc1gmtS2p78E5zPL2ESDGnQtl,FALSE,FALSE,NaN,546,0,56,30,0,0,NaN
6.15114E+14,1E+14,SUGARCANE,Oo - Up Dharma Down | Cover by SUGARCANE,"Oo - Up Dharma Down | Cover by SUGARCANE

Watch here: https://vt.tiktok.com/ZSRrS5hRW/?k=1

Follow us on Tiktok and watch the full video of Carl and Cedric's rendition of ""Oo"" by Up Dharma Down. 

Stream our songs here: thesugarcaneph.biglink.to/platforms",Videos,15,8/10/2022 5:05,2022,8,10,5:05:00,https://www.facebook.com/reel/454314983241895/,FALSE,FALSE,NaN,408,720,32,2,0,37376.61,NaN
6.15747E+14,1E+14,SUGARCANE,"Husay! ????

Steam & watch ?Paruparo? here: https://sugarcane.lnk.to/paruparo",,Text,0,8/11/2022 4:03,2022,8,11,4:03:00,https://www.facebook.com/thesugarcaneph/posts/pfbid02PhiNxXGWyNfCn6Z8cBoFFvHx8hiMwUayTJ6Ctg5o9dyU4PgkZ3aCZb8VWSefwNEYl,FALSE,TRUE,NaN,88,118,0,1,0,0,NaN
6.1651E+14,1E+14,SUGARCANE,Kita kits bukas!,,Photos,0,8/12/2022 7:31,2022,8,12,7:31:00,https://www.facebook.com/thesugarcaneph/posts/pfbid0pwTWisEuW5HVTvmjYceZgZxf82AGEvwe7nAT5xoVWQmRtsHv73xjBVEkrZm7tC1vl,FALSE,TRUE,NaN,63,0,1,1,0,0,NaN
6.1702E+14,1E+14,SUGARCANE,Can?t wait to see you al!! ??,,Photos,0,8/13/2022 1:42,2022,8,13,1:42:00,https://www.facebook.com/thesugarcaneph/posts/pfbid02HpeiTbEMg6n9gUCGKW8uA8rSLWFNyRWvR1RMDK8ZnKz4deRbFY5wZQajnDV23mm2l,FALSE,TRUE,NaN,97,0,2,1,0,0,NaN
6.17766E+14,1E+14,SUGARCANE,"Gig at saGuijo Cafe + Bar Events last night ????

Massive thanks to ?Think Things Through?, especially to Mr. Rem Brofar, and to everyone that joined us last night.

It was also an unforgettable experience to be accompanied by Leanne & Naara, Jensen Gomez, Basically Saturday Night, No Lore, & Aster.

??: Gilliane Bernabe",,Photos,0,8/14/2022 5:05,2022,8,14,5:05:00,https://www.facebook.com/thesugarcaneph/posts/pfbid02PsKmD83aq7VicN481b7pnqz1UgHCyAPDPsG9MtZZ6i7W6qa7x8mviLK8AycDuTdzl,FALSE,FALSE,NaN,479,8,22,6,0,0,NaN
6.18398E+14,1E+14,SUGARCANE,SUGARCANE - Paruparo | Live at saGuijo,"??@[100064693176402:2048:saGuijo] | 8.13.22

?Paruparo? by SUGARCANE ??

Stream our latest single here: https://sugarcane.lnk.to/paruparo",Videos,301,8/15/2022 4:00,2022,8,15,4:00:00,https://www.facebook.com/thesugarcaneph/videos/1414133125755548/,FALSE,FALSE,NaN,579,867,51,15,0,98077.27,NaN
6.19071E+14,1E+14,SUGARCANE,SUGARCANE - ?Paruparo? Duet,"SUGARCANE - Paruparo

Follow us on Tiktok and be ready for a challenge that will be posted on Thursday. ??

??: https://vt.tiktok.com/ZSRkXeqf3/",Videos,20,8/16/2022 4:43,2022,8,16,4:43:00,https://www.facebook.com/reel/5449232245171679/,FALSE,FALSE,NaN,339,715,26,9,0,37431.81,NaN
6.20359E+14,1E+14,SUGARCANE,"SUGARCANE - ""Paruparo"" Duet","Up for a challenge? ??

Follow us on Tiktok and take on the #ParuparoBiritChallenge, by duetting the video on the link provided. Tag your friends and don?t forget to use the hashtag.

Duet here: https://vt.tiktok.com/ZSRBU3HR5/

Stream ?Paruparo?: sugarcane.lnk.to/paruparo",Videos,58,8/18/2022 5:27,2022,8,18,5:27:00,https://www.facebook.com/reel/782107972871769/,FALSE,FALSE,NaN,157,359,11,3,0,42383.07,NaN
6.22916E+14,1E+14,SUGARCANE,"Take on the challenge and use the hashtag, #ParuparoBiritChallenge","Nagbabalik kami para sa isang hamon! ??

Follow us on Tiktok and duet the video on the comment section. Take on the challenge and don?t forget to use the hashtag, #ParuparoBiritChallenge!

??: https://vt.tiktok.com/ZSRS7A2Cp/",Videos,44,8/22/2022 4:35,2022,8,22,4:35:00,https://www.facebook.com/reel/1189604561601699/,FALSE,FALSE,NaN,472,1267,44,23,0,84611.13,NaN
6.25568E+14,1E+14,SUGARCANE,"Thank you MANILA BULLETIN! ??

Our latest single, ""Paruparo"", has been featured in Manila Bulletin?s entertainment news article. 

To read more about the well-written write-up made for ""Paruparo"", check the link below: 

??: http://lnkiy.in/SugarcaneManilaBulletin",,Photos,0,8/26/2022 4:00,2022,8,26,4:00:00,https://www.facebook.com/thesugarcaneph/posts/pfbid02MgXoD4SLqLpHxkiDZXhR2tUMRbnhdAJNXMAy94p3YSzGH8u9U8b6znVn2TN7YU5sl,FALSE,FALSE,NaN,399,0,41,8,0,0,NaN
6.27703E+14,1E+14,SUGARCANE,"SUGARCANE, JC Herrero - ""Paruparo"" Flute Tutorial","SUGARCANE, JC Herrero - ""Paruparo"" Flute Tutorial

Follow us on Tiktok and take on our newest challenge, #ParuparoBiritChallenge ??

??: https://vt.tiktok.com/ZSRUyepNV/",Videos,16,8/29/2022 4:22,2022,8,29,4:22:00,https://www.facebook.com/reel/838881174189153/,FALSE,FALSE,NaN,286,420,16,4,0,29411.08,NaN
6.28413E+14,1E+14,SUGARCANE,Happy 1 Million Streams ?Kung Maging Akin Ka?,"Happy 1 Million Streams ?Kung Maging Akin Ka? ??

Thank you for the unending love and support! 

Keep streaming here: https://sugarcane.lnk.to/kungmagingakinka",Videos,16,8/30/2022 4:00,2022,8,30,4:00:00,https://www.facebook.com/reel/3489094874670302/,FALSE,FALSE,NaN,1358,1119,121,89,0,57312.03,NaN
6.4595E+14,1E+14,SUGARCANE,SUGARCANE just got nominated at MYX's Awit Awards 2022 for Favorite Group Artist!,"SUGARCANE just got nominated at MYX's Awit Awards 2022 for Favorite Group Artist! 

Maraming salamat sa lahat ng patuloy na sumusuporta. 

The mere fact pa lang na we were included in this year's list of nominees, ay sobrang nakakataba na ng puso at sapat na! ??

Special thanks to @[100064878091978:2048:Warner Music Philippines], Sir Kelley Mangahas, Sir Rem Brofar, and the whole Warner Family.

#AwitAwards2022
#WarnerMusicPH",Videos,37,9/24/2022 4:00,2022,9,24,4:00:00,https://www.facebook.com/reel/1095500494674448/,FALSE,FALSE,NaN,1941,1888,116,182,0,1794,NaN
6.49803E+14,1E+14,SUGARCANE,"To vote for us, text ???????? ???????? to 8933

We thank everyone who made this possible, especially you, guys!! ??",,Photos,0,9/29/2022 2:52,2022,9,29,2:52:00,https://www.facebook.com/thesugarcaneph/posts/pfbid02QiuWSNLN9fgTaKyxi2qULWEosyBKHohPU5nVPoonFCz7sfyTQcHUyfBJJdYr1GFfl,FALSE,TRUE,NaN,44,0,1,0,0,0,NaN
6.52284E+14,1E+14,SUGARCANE,"Happy birthday to our drummer, Froilan Bautista!! ????",,Photos,0,10/2/2022 4:00,2022,10,2,4:00:00,https://www.facebook.com/thesugarcaneph/posts/pfbid0xPiDs2UszRzwtS5sE7VGmKKqPKe1cW5xoyjPWv7FoUGjmd3zBD7MNXfn14waAQnZl,FALSE,FALSE,NaN,531,0,10,68,0,0,NaN
6.57179E+14,1E+14,SUGARCANE,"Catch us live tomorrow, October 9, at 11:45 AM on #iWantASAP! 

You can watch it on the iWantTFC Facebook page and Youtube Channel! Kita kits tayo bukas. ????",,Photos,0,10/8/2022 4:20,2022,10,8,4:20:00,https://www.facebook.com/thesugarcaneph/posts/pfbid02eTV4cdNVgCij9pETnqhLxHBGKpHj4ccN3p27Lzhmn2YNeM2Qi4tkxFMnTscn3jWQl,FALSE,FALSE,NaN,762,0,98,18,0,0,NaN
6.57954E+14,1E+14,SUGARCANE,SUGARCANE ft. JC Herrero - Paruparo | Live at iWant ASAP,"?Paruparo? Live at iWant ASAP | 10.9.22 ??

It was a blessed Sunday indeed, as today marks our first ASAP guesting as a band. Maraming salamat sa mga sumubaybay at nanood kanina!

Here?s a snippet of our ASAP performance! ????

Stream here: https://sugarcane.lnk.to/paruparo",Videos,98,10/9/2022 4:28,2022,10,9,4:28:00,https://www.facebook.com/reel/466630435529673/,FALSE,FALSE,NaN,1142,2053,84,75,0,1763,NaN
6.6013E+14,1E+14,SUGARCANE,"1 Million Streams na ang ""Gunita"" ????","1 Million Streams na ang ""Gunita"" ????

Two of our songs, ""Kung Maging Akin ka"" & ""Gunita"", reached a million streams this year. What a year this has been for us! Maraming Salamat! Sobrang na-appreciate namin lahat ng suporta niyo. 

PS. Two songs din back-to-back ang dapat niyong abangan next year. ??

Stream here: https://sugarcane.lnk.to/gunita",Videos,35,10/12/2022 4:00,2022,10,12,4:00:00,https://www.facebook.com/reel/5256864937770215/,FALSE,FALSE,NaN,1552,1020,163,97,0,918,NaN
6.61164E+14,1E+14,SUGARCANE,"Join us this October 15, 7 PM, at Milenya PH for SUD?s Dumaloy Album Tour!

We will be sharing the stage with SUD, Leanne & Naara, and TONEEJAY. Kitakits! Excited kaming makita at makasama kayo. ??",,Photos,0,10/13/2022 4:00,2022,10,13,4:00:00,https://www.facebook.com/thesugarcaneph/posts/pfbid02w4Av39MqFtukzPZvS5anbSHp5EyJxpdjkUqWaHMToJWr3hWxAodtQpKuNFGoXqhGl,FALSE,FALSE,NaN,312,3,34,9,0,3,NaN
6.61961E+14,1E+14,SUGARCANE,See you!! ????,,Photos,0,10/14/2022 4:01,2022,10,14,4:01:00,https://www.facebook.com/thesugarcaneph/posts/pfbid0hE8iByV8jvdGZVfhMiKeiXnjArt5orCnLVD44hYuCrNUx86xEREPqCVbM74ajbGul,FALSE,TRUE,NaN,172,0,9,1,0,0,NaN
6.62702E+14,1E+14,SUGARCANE,"Maraming Salamat!! ????

SUGARCANE just reached 100k monthly listeners on Spotify! Words cannot express how much this means to us. 

This would not be possible without our Warner Music Philippines Family, and our beloved SUGARCANE Family. Success nating lahat ?to! Makakaasa kayo na mas huhusayan pa namin. Mahal na mahal namin kayo.??",,Photos,0,10/15/2022 4:00,2022,10,15,4:00:00,https://www.facebook.com/thesugarcaneph/posts/pfbid0sUTKyf7Z63h7yVfa3tJqLkHANKKVRRoeuUnPAAd39ZiPhkNuFikDVu7yiDbqCK8ul,FALSE,FALSE,NaN,811,0,48,42,0,0,NaN
6.63442E+14,1E+14,SUGARCANE,"SUD's Dumaloy Album Tour | 10.15.22

STORY TIME ??

As most of you already know, nagsimula talaga kami as a cover band, at isa sa go-to songs namin that time ay ""Sila"" by SUD. Hindi mawawala sa band repertoire namin dati 'yun, kasi sobrang enjoy na enjoy kami tugtugin 'yun. Ultimo yung sax parts ginagaya namin using Cedric's handy-dandy melodica, since wala naman kaming sax talaga. 

Nakakakilig lang isipin na ngayon, we were lucky enough to be given the chance na makasama sa album tour nila. This gig really meant a lot para sa amin as a band. Thank you SUD! Maraming salamat din sa lahat ng mga nanood at sumuporta. 

Special thanks to Warner Music Philippines, All Goods Productions, Milenya PH, Leanne & Naara, and TONEEJAY, sobrang solid niyo pong lahat! ????

Check video sa comments section! HAHAHA

??: Gilliane Bernabe",,Photos,0,10/16/2022 4:25,2022,10,16,4:25:00,https://www.facebook.com/thesugarcaneph/posts/pfbid0vFsHCSFZ4LzeWXfhdh7dyPKM6WTnnjrm2PbaEWXtHSSPMWmU1w1N769AvLr4X2g8l,FALSE,FALSE,NaN,1005,5,77,18,0,0,NaN
6.64131E+14,1E+14,SUGARCANE,"""Gunita"" Live at SUD's Dumaloy Album Tour","?? @[100069527318186:2048:Milenya PH]  | 10.15.22

""Gunita"" Live at SUD's Dumaloy Album Tour ?

Stream here: https://sugarcane.lnk.to/gunita",Videos,306,10/17/2022 4:00,2022,10,17,4:00:00,https://www.facebook.com/thesugarcaneph/videos/666104781509642/,FALSE,FALSE,NaN,1092,1599,117,28,0,1287,NaN
6.66279E+14,1E+14,SUGARCANE,"""Sa'yo"" by Munimuni | Jamming with TJ de Ocampo","Dream Come True ?

""Sa'yo"" by Munimuni | Jamming with @[100024845280563:2048:TONEEJAY] 

Sobrang salamat po for letting us jam with you on this masterpiece! ????",Videos,114,10/20/2022 3:59,2022,10,20,3:59:00,https://www.facebook.com/reel/532935638839134/,FALSE,FALSE,NaN,54586,52648,8740,571,0,47800,NaN
6.67745E+14,1E+14,SUGARCANE,"""Paruparo"" Live at Showtime | 10.22.22 ??","""Paruparo"" Live at Showtime | 10.22.22 ??

Happy Saturday! Here's a snippet of our first Showtime guesting. Hope you like it. ????",Videos,166,10/22/2022 4:19,2022,10,22,4:19:00,https://www.facebook.com/reel/676170843768467/,FALSE,FALSE,NaN,833,1712,64,21,0,1443,NaN
6.73661E+14,1E+14,SUGARCANE,"Happy birthday to our lead guitarist, Frain Reyes!! ????",,Photos,0,10/30/2022 4:18,2022,10,30,4:18:00,https://www.facebook.com/thesugarcaneph/posts/pfbid02BBuMQMfFC5ZcuD32kXoUsEjZQLGKcp2W5wEc8NDNeFpKVFSFxUYcqfVboxQtCZPQl,FALSE,FALSE,NaN,580,0,18,49,0,0,NaN
6.88699E+14,1E+14,SUGARCANE,"?????????? ???????????? ???? ???????????????? ??

Since umabot ng almost 400k views yung jamming namin with TONEEJAY last time, gumawa kami ng cover ng isa niya pang kanta para sa inyo. At baka hindi niyo pa alam na may secret version din si TJ ng kanta na 'to kasama si syd hartha, stream niyo na rin! bfan.link/bawat-piyesa-svv","?????????? ???????????? ???? ???????????????? ??

Since umabot ng almost 400k views yung jamming namin with @[100024845280563:2048:TONEEJAY] last time, gumawa kami ng cover ng isa niya pang kanta para sa inyo. At baka hindi niyo pa alam na may secret version din si TJ ng kanta na 'to kasama si @[100044275907230:2048:syd hartha], stream niyo na rin! bfan.link/bawat-piyesa-svv",Videos,113,11/19/2022 17:21,2022,11,19,17:21:00,https://www.facebook.com/reel/542168587330984/,FALSE,FALSE,NaN,675,1319,56,21,0,0,NaN
6.92922E+14,1E+14,SUGARCANE,??,,Photos,0,11/26/2022 2:25,2022,11,26,2:25:00,https://www.facebook.com/thesugarcaneph/posts/pfbid0vF6v5nL2ihH9fyhNvFWKM2vtLb4MRuAFa4wATMnsXbcGwx8uvWhdxEA4eYcBaLCyl,FALSE,TRUE,NaN,429,0,26,9,0,0,NaN
6.96007E+14,1E+14,SUGARCANE,"Maraming salamat! ??

This has been our most successful year in terms of streams, and this wouldn?t have been possible without all of your support. Stay tuned for 2023, more are definitely yet to come!! ????

Thank you Warner Music Philippines & SUGARCANE Family.",,Photos,0,12/1/2022 2:00,2022,12,1,2:00:00,https://www.facebook.com/thesugarcaneph/posts/pfbid0CWTgDedRQfGfqufTkHLdVkKbFnHRYxg1sk9oKLD79QPDvTmG5sdCE4PHwLfpr33hl,FALSE,FALSE,NaN,1435,2,106,55,0,2,NaN
7.04034E+14,1E+14,SUGARCANE,"??Ayala Malls Feliz | 12.10.22

?Kung Maging Akin Ka? Live at Galugarin Pilipinas Expo 2022 

Stream here: https://sugarcane.lnk.to/kungmagingakinka","??Ayala Malls Feliz | 12.10.22

?Kung Maging Akin Ka? Live at Galugarin Pilipinas Expo 2022 

Stream here: https://sugarcane.lnk.to/kungmagingakinka",Videos,250,12/11/2022 3:37,2022,12,11,3:37:00,https://www.facebook.com/reel/1600887657034608/,FALSE,FALSE,NaN,2044,2851,235,90,0,0,NaN
7.19096E+14,1E+14,SUGARCANE,"Last Gig for 2022 ??

Happy New Year everyone! See you on 2023, marami kaming upcoming releases. ??

Bawat Piyesa (Secret Verse Ver.) | TONEEJAY","Last Gig for 2022 ??

Happy New Year everyone! See you on 2023, marami kaming upcoming releases. ??

Bawat Piyesa (Secret Verse Ver.) | @[100024845280563:2048:TONEEJAY]",Videos,365,12/31/2022 2:14,2022,12,31,2:14:00,https://www.facebook.com/thesugarcaneph/videos/1352882935465876/,FALSE,FALSE,NaN,1615,2009,123,39,0,0,NaN
7.32409E+14,1E+14,SUGARCANE,"Happy 2 Million Streams ""Kung Maging Akin Ka""","Happy 2 Million Streams ""Kung Maging Akin Ka""!! ??

Last August 30, 2022, ""Kung Maging Akin Ka"" reached 1 million streams, and in just 5 months, another million streams were added to this song! 

Maraming salamat malala!! Mas lalo pa naming paghuhusayan. ????

PS. Madami dami nang niluluto...",Videos,11,1/21/2023 3:25,2023,1,21,3:25:00,https://www.facebook.com/reel/481926084108025/,FALSE,FALSE,NaN,1885,1538,183,132,0,1322,NaN
7.33202E+14,1E+14,SUGARCANE,"Spryta Recording Studio | January 16, 2022 

Recording (BTS) ??",,Photos,0,1/22/2023 3:00,2023,1,22,3:00:00,https://www.facebook.com/thesugarcaneph/posts/pfbid02v1LkP2LGKAhyPHC3kYHbtH37JvsKkFEALk9C1d1RK1MkXx4pKqHgzLzzwFnvYeQel,FALSE,FALSE,NaN,520,0,31,20,0,0,NaN
7.44499E+14,1E+14,SUGARCANE,????,,Photos,0,2/8/2023 8:19,2023,2,8,8:19:00,https://www.facebook.com/thesugarcaneph/posts/pfbid0ysYtkKhjh2wiHKJ24QujhveqkR8m8odqqSwUkf9Ax5U6tuSn46th5pKf5TN6geNpl,FALSE,TRUE,NaN,565,1,37,13,1,0,NaN
7.45755E+14,1E+14,SUGARCANE,"Vocalist namin nasiraan na ng bait dahil wala na makain kaka-gate keep niyo.

",,Links,0,2/10/2023 6:58,2023,2,10,6:58:00,https://www.facebook.com/thesugarcaneph/posts/pfbid0iev2MbaJSrwEGHTw8JJsw1vjR9KKKM1dtXMczkqXtzJDz7dDXfFctdZJBv2C6iYCl,FALSE,FALSE,NaN,440,0,29,42,0,0,NaN
7.46325E+14,1E+14,SUGARCANE,#wagtularan,,Photos,0,2/11/2023 4:34,2023,2,11,4:34:00,https://www.facebook.com/thesugarcaneph/posts/pfbid0378Sp3RC62vcJ2mhBcNVgCNmd82KNZxESYVQExXGrdfTMKB4xxA33SGjxQh7iBh5wl,FALSE,FALSE,NaN,1541,4,156,84,3,1,NaN
7.48176E+14,1E+14,SUGARCANE,"Happy Valentine?s Day Everyone!
#dalhinmoakosadilim??",,Photos,0,2/14/2023 1:24,2023,2,14,1:24:00,https://www.facebook.com/thesugarcaneph/posts/pfbid02zwFfzqsLdDmsBY52DST4L2jiedgGpD5SYMdABSq6rWjKdr6DJiXHzF9T4krMyhVMl,FALSE,FALSE,NaN,1252,4,97,59,3,1,NaN
7.48316E+14,1E+14,SUGARCANE,"Happy hearts day!! ?Di ka man naalala ng loml mo ngayong araw, pero kami araw-araw naming ipaparamdam sa?yo na mahalaga ka ayiee ????

?? *Photos were from the winners of the ?Paruparo? Flower giveaway*",,Photos,0,2/14/2023 5:52,2023,2,14,5:52:00,https://www.facebook.com/thesugarcaneph/posts/pfbid02D39YkcT2grYUnyqepKds21ZbgcLV68YCR9UCBz2HDAg1Md2bhGNYaJWtZAUh1A3Xl,FALSE,FALSE,NaN,381,0,7,16,0,0,NaN
7.49538E+14,1E+14,SUGARCANE,"Sheeeeshh what if gawa kami ng gantong version? ??

Cover by @eprelandreya on TikTok ??","Sheeeeshh what if gawa kami ng gantong version? ??

Cover by @eprelandreya on TikTok ??",Videos,31,2/16/2023 4:04,2023,2,16,4:04:00,https://www.facebook.com/reel/1136201193713140/,FALSE,FALSE,NaN,1169,2062,100,78,0,1759,NaN
7.50789E+14,1E+14,SUGARCANE,"Pasilyo by SunKissed Lola ??

??: Miss Khristine Cabuslay","Pasilyo by @[100083282465435:2048:SunKissed Lola] ??

??: @[100071128170322:2048:Miss Khristine] Cabuslay",Videos,163,2/18/2023 1:48,2023,2,18,1:48:00,https://www.facebook.com/reel/672981501252054/,FALSE,FALSE,NaN,243391,320930,12461,2769,0,285145,NaN
7.60556E+14,1E+14,SUGARCANE,Kita kits!! ????,,Photos,0,3/6/2023 3:48,2023,3,6,3:48:00,https://www.facebook.com/thesugarcaneph/posts/pfbid03eJKyVLUeHVPGNWzcZVi9Vhy5EBnst8td5nmybSFCTkd8tFRXTpbGXFKFGjRrqiml,FALSE,TRUE,NaN,158,0,7,10,0,0,NaN
7.6367E+14,1E+14,SUGARCANE,UHAW - DILAW,"UHAW - @[100068367903155:2048:Dilaw]

Been a fan of Dilaw unang kanta palang nila grabe! Pakinggan niyo rin iba nilang songs sobrang solid talaga ?

Stream ""Uhaw"" here: Dilaw.lnk.to/UhawTayongLahat",Videos,128,3/11/2023 21:00,2023,3,11,21:00:00,https://www.facebook.com/reel/2433613330126497/,FALSE,FALSE,NaN,70024,55784,4399,816,0,48801,NaN
7.63875E+14,1E+14,SUGARCANE,"Happy 200k Monthly Listeners on Spotify ???? 

Thank you Warner Music Philippines & SUGARCANE Family! 

Makaaasa kayo na ?di namin kayo bibiguin bago matapos ang buwan na to. Kaabang-abang to!! ??

Poster by: Miss Khristine",,Photos,0,3/12/2023 5:07,2023,3,12,5:07:00,https://www.facebook.com/thesugarcaneph/posts/pfbid02gbsgCENhFdU3X6Uzz3ALqDCfnMXR6ZWFh6PUStsSsg96ScZuoYPYn8r3WVK1joVil,FALSE,FALSE,NaN,698,0,49,43,0,0,NaN
7.64872E+14,1E+14,SUGARCANE,Kung Maging Akin Ka (Acoustic),"Kung Maging Akin Ka (Acoustic)
https://sugarcane.lnk.to/kungmagingakinka",Videos,143,3/14/2023 4:00,2023,3,14,4:00:00,https://www.facebook.com/reel/590005502780106/,FALSE,FALSE,NaN,3068,3274,399,137,0,2682,NaN
7.67212E+14,1E+14,SUGARCANE,Gunita (Acoustic),"Big announcement on Monday, 8pm  ?

Gunita (Acoustic) muna tayo bago ang big announcement:",Videos,220,3/18/2023 5:39,2023,3,18,5:39:00,https://www.facebook.com/reel/173751002134983/,FALSE,FALSE,NaN,2914,2660,227,76,0,2181,NaN
7.68366E+14,1E+14,SUGARCANE,"Ito na! This coming March 31, may bago kaming single! Stay tuned on our social media platforms for more updates ??",,Photos,0,3/20/2023 5:00,2023,3,20,5:00:00,https://www.facebook.com/thesugarcaneph/posts/pfbid0aQnw15htChxERr6pmzdahPhuEM8xK1ZqrbguKXWRxBfAABDRRtRhvdriqDhw15z7l,FALSE,FALSE,NaN,2191,16,266,174,3,13,NaN
7.68394E+14,1E+14,SUGARCANE,SUGARCANE updated their cover photo.,,Photos,0,3/20/2023 6:04,2023,3,20,6:04:00,https://www.facebook.com/photo.php?fbid=768393997980948&set=a.228682271952126&type=3,FALSE,FALSE,NaN,1091,0,27,32,0,0,NaN
7.71104E+14,1E+14,SUGARCANE,"PRE-SAVE:
sugarcane.lnk.to/presaveleonora

Warner Music Philippines

Art by: Felix Gasmen",,Photos,0,3/25/2023 3:00,2023,3,25,3:00:00,https://www.facebook.com/thesugarcaneph/posts/pfbid02YqpX6GkZHJA27yyiGAVzTSsqWkVmbg5A2ZGMw4Bi6HdDBmxqdPCmYWsxiQzcpVSml,FALSE,FALSE,NaN,1199,2,138,87,2,0,NaN
7.72136E+14,1E+14,SUGARCANE,"sugarcane.lnk.to/presaveleonora

Color Grading: Rem Brofar
Graphic Design/Photographer: Miss Khristine",,Photos,0,3/27/2023 5:08,2023,3,27,5:08:00,https://www.facebook.com/thesugarcaneph/posts/pfbid02nQML3tMRQ6EVij3SABvZiJX6QSrR33Sxkvs9PFTXYqR2hpoyKPYK7jPzYuT4nrFUl,FALSE,FALSE,NaN,474,1,28,11,1,0,NaN
7.72667E+14,1E+14,SUGARCANE,What if i-release na namin ?to? #fypmusic #opm #thesugarcaneph #leonora,What if i-release na namin ?to? #fypmusic #opm #thesugarcaneph #leonora,Reels,32,3/28/2023 6:58,2023,3,28,6:58:00,https://www.facebook.com/reel/738277427767011/,FALSE,FALSE,NaN,1201,2576,96,40,0,867,NaN
7.73057E+14,1E+14,SUGARCANE,"sugarcane.lnk.to/presaveleonora

Isang tulog na lang at mapakikinggan na rin nating lahat ang bago naming kanta na pinamagatang, ""Leonora""! I-pre save mo na!! :') 

Color Grading: Rem Brofar 
Graphic Design:  Miss Khristine
Photographer: Miss Khristine & NXMedia",,Photos,0,3/29/2023 3:00,2023,3,29,3:00:00,https://www.facebook.com/thesugarcaneph/posts/pfbid0J7FYgPDANwYQj3ZD2HcsWjvf1eywKofxDrbWxBtwGXT3MrFwvR1dA9Runtn4PRGPl,FALSE,FALSE,NaN,365,0,25,25,0,0,NaN
7.73668E+14,1E+14,SUGARCANE,"sugarcane.lnk.to/presaveleonora

Handa na ba ang lahat? Isang oras na lang at mapakikinggan na sa lahat ng digital platforms ang ""Leonora"". Kung ako sa'yo ip-pre save ko na 'yan!! ??

Color Grading: Rem Brofar 
Graphic Design: Miss Khristine
Photographer: Miss Khristine & NXMedia",,Photos,0,3/30/2023 8:00,2023,3,30,8:00:00,https://www.facebook.com/thesugarcaneph/posts/pfbid028dNtDxrrSpc68bRG98qhf4yknfdCnHQyha42735AinWz5SiVqTwk51DDTyFciz7el,FALSE,FALSE,NaN,236,0,14,20,0,0,NaN
7.73694E+14,1E+14,SUGARCANE,"""??????????????"", ?????? ??????! ???????????? ????????:
sugarcane.lnk.to/leonora

""Leonora"" is a heart-wrenching tribute to the tragic love story of Jose Rizal and his teenage love, Leonor Rivera. The song captures the essence of the classic tale of forbidden love, as Leonor's mother disapproves of Rizal's work as a propagandist, ultimately tearing the couple apart. 

With its powerful lyrics and emotive melodies, ""Leonora"" paints a picture of a love that could have been, but ultimately never was, and is sure to leave a lasting impression on listeners, as they relate to the universal themes of unrequited love, heartbreak, and the struggles of following one's passions.

Credits:
Lyricist: Froilan Bautista
Composer: Cedric Angeles 
Recorded by: Cedric Angeles, Dennis Celis, & Rene Serna (Spryta Recording Studio)
Producer: Cedric Angeles, Frain Reyes
Mixing Engineer: Jorel Corpus
Mastering Engineer: Jett Galindo of The Bakery L.A.
Art by: Felix Gasmen
Motion Graphic: Ryan Vincent Macao

Warner Music Philippines: 
Sarah Ismail
Kelley Mangahas 
Rem Brofar 
Jam Rances
Nicole De Jesus",,Photos,0,3/30/2023 9:00,2023,3,30,9:00:00,https://www.facebook.com/thesugarcaneph/posts/pfbid02ZZD9jrA3HvT12MPMV4oSjewoPa6yBjobb1s46VXU4eo36SUMqnFxKUe75wuWE1Eql,FALSE,FALSE,NaN,1479,4,224,53,3,1,NaN
7.73709E+14,1E+14,SUGARCANE,"""??????????????"", ?????? ??????! ???????????? ????????:
sugarcane.lnk.to/leonora

""Leonora"" is a heart-wrenching tribute to the tragic love story of Jose Rizal and his teenage love, Leonor Rivera. The song captures the essence of the classic tale of forbidden love, as Leonor's mother disapproves of Rizal's work as a propagandist, ultimately tearing the couple apart. 

With its powerful lyrics and emotive melodies, ""Leonora"" paints a picture of a love that could have been, but ultimately never was, and is sure to leave a lasting impression on listeners, as they relate to the universal themes of unrequited love, heartbreak, and the struggles of following one's passions.

Credits:
Lyricist: Froilan Bautista
Composer: Cedric Angeles 
Recorded by: Cedric Angeles, Dennis Celis, & Rene Serna (Spryta Recording Studio)
Producer: Cedric Angeles, Frain Reyes
Mixing Engineer: Jorel Corpus
Mastering Engineer: Jett Galindo of The Bakery L.A.
Art by: Felix Gasmen
Motion Graphic: Ryan Vincent Macao

Warner Music Philippines: 
Sarah Ismail
Kelley Mangahas 
Rem Brofar 
Jam Rances
Nicole De Jesus",,Photos,0,3/30/2023 9:32,2023,3,30,9:32:00,https://www.facebook.com/photo.php?fbid=773708764116138&set=a.228682271952126&type=3,FALSE,FALSE,NaN,711,3,46,9,0,3,NaN
7.73948E+14,1E+14,SUGARCANE,"""Leonora"" out now!","""??????????????"", ?????? ??????! ???????????? ????????: sugarcane.lnk.to/leonora

A heartfelt appreciation for Felix Gasmen, the one behind our single arts since our first-ever release. His works are a masterpiece in their own right that perfectly captures the spirit and essence of the music within. ??

Thank you, Felix, for your incredible talent and dedication to your craft. Check out more of his projects at: instagram.com/artsbyfelix",Videos,30,3/30/2023 21:56,2023,3,30,21:56:00,https://www.facebook.com/reel/238375825273478/,FALSE,FALSE,NaN,4565,7129,1174,117,0,4973,NaN
7.74087E+14,1E+14,SUGARCANE,"""??????????????"", ?????? ??????! ???????????? ????????:
sugarcane.lnk.to/leonora

""Leonora"" is a heart-wrenching tribute to the tragic love story of Jose Rizal and his teenage love, Leonor Rivera. The song captures the essence of the classic tale of forbidden love, as Leonor's mother disapproves of Rizal's work as a propagandist, ultimately tearing the couple apart. 

With its powerful lyrics and emotive melodies, ""Leonora"" paints a picture of a love that could have been, but ultimately never was, and is sure to leave a lasting impression on listeners, as they relate to the universal themes of unrequited love, heartbreak, and the struggles of following one's passions.

Credits:
Lyricist: Froilan Bautista
Composer: Cedric Angeles 
Recorded by: Cedric Angeles, Dennis Celis, & Rene Serna (Spryta Recording Studio)
Producer: Cedric Angeles, Frain Reyes
Mixing Engineer: Jorel Corpus
Mastering Engineer: Jett Galindo of The Bakery L.A.
Art by: Felix Gasmen
Motion Graphic: Ryan Vincent Macao
Photo by: Nix Orbon

Warner Music Philippines: 
Sarah Ismail
Kelley Mangahas 
Rem Brofar 
Jam Rances
Nicole De Jesus",,Photos,0,3/31/2023 5:11,2023,3,31,5:11:00,https://www.facebook.com/photo.php?fbid=774086907411657&set=a.228682278618792&type=3,FALSE,FALSE,NaN,2388,1,97,57,1,0,NaN
7.74578E+14,1E+14,SUGARCANE,"Stream ""Leonora"" habang wala pa:
sugarcane.lnk.to/leonora ?",,Photos,0,4/1/2023 5:01,2023,4,1,5:01:00,https://www.facebook.com/thesugarcaneph/posts/pfbid02A7DXg2ScJj7mRXVncmJVFJcpf9W3MzTf9f8nH23iKZQTDAckZxpkSMfnKrrPJFsrl,FALSE,FALSE,NaN,1531,15,137,110,5,10,NaN
7.75551E+14,1E+14,SUGARCANE,"Our latest single ""Leonora"" has been featured on Spotify's New Music Friday and OPM on the Rise playlists! It's an incredible honor to have our music recognized and shared with new listeners. 

Thank you to everyone who has supported us so far. Check out the links below to give ""Leonora"" a listen and add it to your playlists!

New Music Friday: spotify.link/wuoyaj18Gyb

OPM on the Rise: spotify.link/t1gdmD38Gyb

Continue streaming here: sugarcane.lnk.to/leonora","Our latest single ""Leonora"" has been featured on Spotify's New Music Friday and OPM on the Rise playlists! It's an incredible honor to have our music recognized and shared with new listeners. 

Thank you to everyone who has supported us so far. Check out the links below to give ""Leonora"" a listen and add it to your playlists!

New Music Friday: spotify.link/wuoyaj18Gyb

OPM on the Rise: spotify.link/t1gdmD38Gyb

Continue streaming here: sugarcane.lnk.to/leonora",Videos,10,4/3/2023 4:24,2023,4,3,4:24:00,https://www.facebook.com/reel/594242362638360/,FALSE,FALSE,NaN,492,334,38,18,262,54,NaN
7.76033E+14,1E+14,SUGARCANE,Leonora by SUGARCANE - Official Lyric Video,"Watch here: youtu.be/hOf7m31ZvgQ

Check out ""Leonora""'s official lyric video, available on YouTube. ??

Lyric video taken care of Ryan Vincent Macao, more of his works at tiktok.com/@ryanvincentm",Videos,46,4/4/2023 3:56,2023,4,4,3:56:00,https://www.facebook.com/reel/1277032019863990/,FALSE,FALSE,NaN,68178,47555,11448,1158,38542,8260,NaN
7.76491E+14,1E+14,SUGARCANE,"sugarcane.lnk.to/leonora
Jose Rizz-al ??

Follow us on Tiktok: tiktok.com/@thesugarcaneph","sugarcane.lnk.to/leonora
Jose Rizz-al ??

Follow us on Tiktok: tiktok.com/@thesugarcaneph",Videos,90,4/5/2023 3:01,2023,4,5,3:01:00,https://www.facebook.com/reel/2999216333721462/,FALSE,FALSE,NaN,1220,1982,74,32,1589,348,NaN
7.77539E+14,1E+14,SUGARCANE,"sugarcane.lnk.to/leonora

Follow us on Tiktok: tiktok.com/@thesugarcaneph","sugarcane.lnk.to/leonora

Follow us on Tiktok: tiktok.com/@thesugarcaneph",Videos,16,4/7/2023 3:12,2023,4,7,3:12:00,https://www.facebook.com/reel/227564569944885/,FALSE,FALSE,NaN,791,821,81,11,629,184,NaN
7.78038E+14,1E+14,SUGARCANE,"Spotify Link: sptfy.com/thesugarcaneph 

Time to flex that special someone ??

Follow us on Tiktok: tiktok.com/@thesugarcaneph

Don?t forget to stream our latest single here as well: sugarcane.lnk.to/leonora","Spotify Link: sptfy.com/thesugarcaneph 

Time to flex that special someone ??

Follow us on Tiktok: tiktok.com/@thesugarcaneph

Don?t forget to stream our latest single here as well: sugarcane.lnk.to/leonora",Videos,53,4/8/2023 3:06,2023,4,8,3:06:00,https://www.facebook.com/reel/985903365900696/,FALSE,FALSE,NaN,1002,1065,119,41,893,160,NaN
7.78563E+14,1E+14,SUGARCANE,"Sheesh-able ??

Happy easter everyone!! ??

Stream our latest single here: sugarcane.lnk.to/leonora",,Photos,0,4/9/2023 3:19,2023,4,9,3:19:00,https://www.facebook.com/thesugarcaneph/posts/pfbid035gTpfZoQ7fGYsUJgWbzSwYuY2DiDQK1kL4qkC5fojXy2tspHEM6k8zr3zoKDjh2ml,FALSE,FALSE,NaN,1573,4,171,35,0,0,NaN
7.7908E+14,1E+14,SUGARCANE,"STREAM HERE:
sugarcane.lnk.to/leonora

sugarcane tiktok era na talaga guys","STREAM HERE:
sugarcane.lnk.to/leonora

sugarcane tiktok era na talaga guys",Videos,87,4/10/2023 3:25,2023,4,10,3:25:00,https://www.facebook.com/reel/524895532943077/,FALSE,FALSE,NaN,71711,155462,7079,848,141564,12824,NaN
7.79588E+14,1E+14,SUGARCANE,"Today marks the 156th birth anniversary of Leonor Rivera, the inspiration behind the character of Maria Clara in ""Noli me Tangere."" Let's commemorate her legacy by listening to ""Leonora,"" a song dedicated to her memory.

sugarcane.lnk.to/leonora",,Photos,0,4/11/2023 3:40,2023,4,11,3:40:00,https://www.facebook.com/thesugarcaneph/posts/pfbid02BFqPBeq8cRCFM5LZxDKdeJWa62trwDVsKzwGSnraRYfq6gEFbpyF8zBy4hKd8TMAl,FALSE,FALSE,NaN,892,5,74,15,4,0,NaN
7.79958E+14,1E+14,SUGARCANE,"3 million streams na ang ?Kung Maging Akin Ka? at 300K monthly listeners na tayo sa Spotify!! 

Swerte ata 3 ah? Maglabas kaya kami ng 3 pang kanta ngayong taon? Ops! ?? Pero sa ngayon, stream niyo muna bago naming single: sugarcane.lnk.to/leonora",,Photos,0,4/11/2023 21:00,2023,4,11,21:00:00,https://www.facebook.com/thesugarcaneph/posts/pfbid02oqMJyux8xUuB1QjXHungftNHd8CNWUTTDWSe5fejru8ow4LYfVSzPgCxsdUYP2nnl,FALSE,FALSE,NaN,8386,19,652,158,12,0,NaN
7.8007E+14,1E+14,SUGARCANE,"ITO HINDI APRIL FOOLS
?Leonora (Official Music Video)?, out this Friday, 8pm! Stay tuned ??

Stream muna habang wala pa: sugarcane.lnk.to/leonora 

#leonora #OPM #thesugarcaneph","ITO HINDI APRIL FOOLS
?Leonora (Official Music Video)?, out this Friday, 8pm! Stay tuned ??

Stream muna habang wala pa: sugarcane.lnk.to/leonora 

#leonora #OPM #thesugarcaneph",Videos,16,4/12/2023 3:05,2023,4,12,3:05:00,https://www.facebook.com/reel/905228600690109/,FALSE,FALSE,NaN,3745,3682,375,119,3160,488,NaN
7.80453E+14,1E+14,SUGARCANE,"SUPERIOR SESSIONS LIVE

with FELIP and Dilaw on April 14, 2023 at Social House, Makati ?? Kitakits!! 

Stream ?Leonora?: sugarcane.lnk.to/leonora",,Photos,0,4/12/2023 21:00,2023,4,12,21:00:00,https://www.facebook.com/thesugarcaneph/posts/pfbid0v5Gs4n3R1QDZh2xoBCqZ7nshoTQKxGW3rXsPgyNyrXCFoxgQ33mret5BzBFmfgw4l,FALSE,FALSE,NaN,389,0,32,21,0,0,NaN
7.80589E+14,1E+14,SUGARCANE,"Bahala kayo dyan ??

Stream niyo nalang ?Leonora?: sugarcane.lnk.to/leonora",,Photos,0,4/13/2023 3:25,2023,4,13,3:25:00,https://www.facebook.com/thesugarcaneph/posts/pfbid0mjujLXwpCjKogxfA5DrrzwfCjWBXaMqhH55rrxs6No1ARoTQYEbTkRFpWqkV8c1Bl,FALSE,FALSE,NaN,4180,16,370,322,7,0,NaN
7.80661E+14,1E+14,SUGARCANE,"?LEONORA? OFFICIAL MV, OUT TOMORROW (4-14-23), AT 8PM!

Subscribe to our YouTube channel and pre-save the Official Music Video for our latest single, ?Leonora?. Don?t forget to click the bell button to be notified tomorrow as we go live on the premiere. ??

https://youtu.be/e_my_QCalLI",,Photos,0,4/13/2023 6:10,2023,4,13,6:10:00,https://www.facebook.com/thesugarcaneph/posts/pfbid0iM7XXKuwHGWqgaQRXsuzEDWA2xEqpRsvs8bJipXgsTTX7NQztw6yfiftzX1Wj846l,FALSE,FALSE,NaN,1784,0,100,50,0,0,NaN
7.81137E+14,1E+14,SUGARCANE,"The Official Music Video of ""Leonora""","WATCH HERE: sugarcane.lnk.to/leonora

The Official Music Video of ""Leonora""

Starring:
Chynna Salazar & Cedric Angeles

Video Production by CHAPTERS PH

Director - John Manalo
Executive Producer - Andromeda Tan
Creative Producer - Jonina Ramos
DOP / Videog - Karlo Calingao
Videog - Lherry De Guzman
Photographer - Louis Duran
Project Manager - Iris Manzano
Assoc Producer - Lyka Estanislao
Video Editor - Nikki Mendoza-Cabanlit
PA - Anthony Dy & Jaybert Rima
Driver - Jay Tesorero & Rodel Mallanes
Lights & Grip - Cinejepoy

Warner Music Philippines: 
Sarah Ismail
Kelley Mangahas 
Rem Brofar 
Jam Rances
Nicole De Jesus",Videos,28,4/14/2023 5:00,2023,4,14,5:00:00,https://www.facebook.com/reel/102161329526587/,FALSE,FALSE,NaN,6143,6884,803,278,4664,2069,NaN
7.81573E+14,1E+14,SUGARCANE,"WATCH HERE: sugarcane.lnk.to/leonora

Naabot natin ang 100K streams sa ""Leonora"" in 2 weeks! ? Grabe yung support niyo, sobrang salamat. Watch niyo na rin yung Official Music Video! ??

'Di pa 'to natatapos sa music video ng ""Leonora"" promise. NANGANGALAHATI PA LANG KAMI HEHEHE",,Photos,0,4/14/2023 21:00,2023,4,14,21:00:00,https://www.facebook.com/thesugarcaneph/posts/pfbid0BKmUSAuBTpHPmgamXuFK4obhZ8oqRj6HxPTGbAqy7TGPBCmYfpPN3PfAbM2pGDXWl,FALSE,FALSE,NaN,1818,0,76,80,0,0,NaN
7.8171E+14,1E+14,SUGARCANE,"WATCH HERE: sugarcane.lnk.to/leonora

Salamat sa 1.5M views sa Tiktok nung nauna naming vid ?? Dahil diyan, ?Leonora? Official MV is now out on our YouTube channel 

Follow niyo rin kami sa Tiktok: tiktok.com/@thesugarcaneph","WATCH HERE: sugarcane.lnk.to/leonora

Salamat sa 1.5M views sa Tiktok nung nauna naming vid ?? Dahil diyan, ?Leonora? Official MV is now out on our YouTube channel 

Follow niyo rin kami sa Tiktok: tiktok.com/@thesugarcaneph",Videos,57,4/15/2023 3:56,2023,4,15,3:56:00,https://www.facebook.com/reel/154329577580572/,FALSE,FALSE,NaN,21083,18591,957,198,16352,1965,NaN
7.82088E+14,1E+14,SUGARCANE,A tribute to Jose Rizal & Leonor Rivera?s tragic love story #leonora #leonorabysugarcane #thesugarcaneph #OPM #sugarcane #fyp #fyp? #fypmusic #leonorrivera #joserizal #joserizzal #jrizz,A tribute to Jose Rizal & Leonor Rivera?s tragic love story #leonora #leonorabysugarcane #thesugarcaneph #OPM #sugarcane #fyp #fyp? #fypmusic #leonorrivera #joserizal #joserizzal #jrizz,Reels,16,4/15/2023 21:04,2023,4,15,21:04:00,https://www.facebook.com/reel/1770304573363427/,FALSE,FALSE,NaN,2000,2166,109,34,589,1575,NaN
7.82095E+14,1E+14,SUGARCANE,"WATCH HERE: sugarcane.lnk.to/leonora
The Official Music Video of ""Leonora""

Starring:
Chynna Salazar & Cedric Angeles

Video Production by CHAPTERS PH
Director - John Manalo
Executive Producer - Andromeda Tan
Creative Producer - Jonina Ramos
DOP / Videog - Karlo Calingao
Videog - Lherry De Guzman
Photographer - Louis Duran
Project Manager - Iris Manzano
Assoc Producer - Lyka Estanislao
Video Editor - Nikki Mendoza-Cabanlit
PA - Anthony Dy & Jaybert Rima
Driver - Jay Tesorero & Rodel Mallanes
Lights & Grip - Cinejepoy

Warner Music Philippines: 
Sarah Ismail
Kelley Mangahas 
Rem Brofar 
Jam Rances
Nicole De Jesus",,Photos,0,4/15/2023 21:20,2023,4,15,21:20:00,https://www.facebook.com/photo.php?fbid=782094796610868&set=a.228682271952126&type=3,FALSE,FALSE,NaN,1433,1,56,74,1,0,NaN
7.82191E+14,1E+14,SUGARCANE,"Stream here:
sugarcane.lnk.to/leonora",,Videos,0,4/16/2023 1:57,2023,4,16,1:57:00,https://www.facebook.com/thesugarcaneph/posts/pfbid022CXwtpZB9vVaScaPQNA3AhWuS51Y2cXeVpZHEY7dfB1dDtKtyy1EUfLEEBKH3YZol,FALSE,TRUE,NaN,1534,1940,0,65,1918,0,NaN
7.8261E+14,1E+14,SUGARCANE,"Akshwalee, pwede nyo na panoorin sa Youtube ang MV ng ""Leonora"" 

sugarcane.lnk.to/leonora","Akshwalee, pwede nyo na panoorin sa Youtube ang MV ng ""Leonora"" 

sugarcane.lnk.to/leonora",Videos,93,4/16/2023 21:01,2023,4,16,21:01:00,https://www.facebook.com/reel/792028462487008/,FALSE,FALSE,NaN,1502,2093,68,52,1775,305,NaN
7.82684E+14,1E+14,SUGARCANE,"Wow solid! ?? Stream ?Leonora? thank you!
sugarcane.lnk.to/leonora",,Videos,0,4/17/2023 1:00,2023,4,17,1:00:00,https://www.facebook.com/thesugarcaneph/posts/pfbid02pFAAS6V1LxYzuWUfchDpSijWcdutVW6x1J4FT4UV9wZdAG8hhN9W37AtKrgKKQqzl,FALSE,TRUE,NaN,1330,1890,0,36,1881,0,NaN
7.8277E+14,1E+14,SUGARCANE,"WATCH HERE: sugarcane.lnk.to/leonora

??: Louis Anthony Duran

We are beyond grateful for the people behind this project that made it into reality! We feel blessed to had such a talented and passionate team to work on this. 

Maraming salamat!! Mahal namin kayo ??

Warner Music Philippines: 
Sarah Ismail
Kelley Mangahas 
Rem Brofar 
Jam Rances
Nicole De Jesus

Production:
Lyricist: Froilan Bautista
Composer: Cedric Angeles 
Recorded by: Cedric Angeles, Dennis Celis, & Rene Serna (Spryta Recording Studio)
Producer: Cedric Angeles, Frain Reyes
Mixing Engineer: Jorel Corpus
Mastering Engineer: Jett Galindo of The Bakery L.A.
Art by: Felix Gasmen
Motion Graphic: Ryan Vincent Macao

Video Production by Chapters PH

Female Lead: Chynna Salazar
Male Lead: Cedric Angeles
Director - John Manalo
Executive Producer - Andromeda Tan
Creative Producer - Jonina Ramos
DOP / Videog - Karlo Calingao
Videog - Lherry De Guzman
Photographer - Louis Duran
Project Manager - Iris Manzano
Assoc Producer - Lyka Estanislao
Video Editor - Nikki Mendoza-Cabanlit
PA - Anthony Dy & Jaybert Rima
Driver - Jay Tesorero, Rodel Mallanes, Teddy Luna
Lights & Grip - Cinejepoy
Hair and Make-up Artists: Riri Wu, Eugene Tiongson, and Paolo Esposo

Special thanks to:
Casa de Segunda
Brofar Family 
SUGARCANE Family",,Photos,0,4/17/2023 3:50,2023,4,17,3:50:00,https://www.facebook.com/thesugarcaneph/posts/pfbid02pXkwBfZeckeeQShZaCypRbfcAWdzWL7jRKCwDvdJ72AGdciETwapEFaK6SYXHCLdl,FALSE,FALSE,NaN,2722,26,160,81,6,0,NaN
7.82844E+14,1E+14,SUGARCANE,"POV: hinaharana ka namin

",,Links,0,4/17/2023 6:51,2023,4,17,6:51:00,https://www.facebook.com/thesugarcaneph/posts/pfbid027fgSzbwnydEJz2rqMUoZ74VBJdfxYuDw9r1KpbwWpbPiMDZbteB4neChiko9nGARl,FALSE,FALSE,NaN,479,0,6,58,0,0,NaN
7.83132E+14,1E+14,SUGARCANE,"sorry credit grabber.

ito yung orig vid: youtu.be/hOf7m31ZvgQ

Edited by: Miss Khristine","sorry credit grabber.

ito yung orig vid: youtu.be/hOf7m31ZvgQ

Edited by: @[100071128170322:2048:Miss Khristine]",Videos,16,4/17/2023 20:49,2023,4,17,20:49:00,https://www.facebook.com/reel/1099579804088282/,FALSE,FALSE,NaN,1722,3444,65,46,2828,549,NaN
7.83197E+14,1E+14,SUGARCANE,Ba?t sa?ting dal?wa ako nalang ang natira?,,Text,0,4/18/2023 0:21,2023,4,18,0:21:00,https://www.facebook.com/thesugarcaneph/posts/pfbid0HCHU26AU7xr78jreDJRoXVGtMvUDTS6kVXsWru4t9QudUs6JihzBaksaw5YzAgFzl,FALSE,FALSE,NaN,2307,31,231,176,31,0,NaN
7.83274E+14,1E+14,SUGARCANE,"POV: We're serenading you

Stream here: sugarcane.lnk.to/leonora","POV: We're serenading you

Stream here: sugarcane.lnk.to/leonora",Videos,40,4/18/2023 4:16,2023,4,18,4:16:00,https://www.facebook.com/reel/787496583003736/,FALSE,FALSE,NaN,76310,60685,6897,1184,54179,5935,NaN
7.83613E+14,1E+14,SUGARCANE,"#cuantochallenge

akala niyo ibang content na no?? hindi!!! leonora parin yan

sugarcane.lnk.to/leonora","#cuantochallenge

akala niyo ibang content na no?? hindi!!! leonora parin yan

sugarcane.lnk.to/leonora",Videos,24,4/18/2023 20:00,2023,4,18,20:00:00,https://www.facebook.com/reel/741158167690680/,FALSE,FALSE,NaN,1905,1558,100,119,1348,209,NaN
7.83689E+14,1E+14,SUGARCANE,"Grabe handwriting yan?! ?? Sobrang galing ??

Stream ?Leonora? here: ??
sugarcane.lnk.to/leonora",,Photos,0,4/19/2023 0:01,2023,4,19,0:01:00,https://www.facebook.com/thesugarcaneph/posts/pfbid02fYAtLxb8ZZLpZE4gGhikn6wMVX6kCVi4NLbReJhsScciFL5Xxmnn8kQi3nNah1Qdl,FALSE,TRUE,NaN,671,2,22,41,0,0,NaN
7.83763E+14,1E+14,SUGARCANE,"maganda to promise
sugarcane.lnk.to/leonora","maganda to promise
sugarcane.lnk.to/leonora",Videos,31,4/19/2023 4:00,2023,4,19,4:00:00,https://www.facebook.com/reel/741974874289759/,FALSE,FALSE,NaN,37451,54783,3768,501,45859,8393,NaN
7.83824E+14,1E+14,SUGARCANE,"Never sumagi sa isip namin na posibleng mangyare ?to! Pero dahil sa suporta niyo, napatunayan naming wala talagang imposible!!! Sobrang solid niyo, maraming salamat ??

Continue streaming here:
sugarcane.lnk.to/kungmagingakinka",,Photos,0,4/19/2023 6:37,2023,4,19,6:37:00,https://www.facebook.com/thesugarcaneph/posts/pfbid0R5Dhg3yWRGLFRbrrpcYrKTH54wcyA1kWuYXj8MqZ2F9WCYFHNyH35Sjpvq7hMoDZl,FALSE,FALSE,NaN,2521,3,158,236,3,0,NaN
7.84137E+14,1E+14,SUGARCANE,"We made it to Spotify's Viral Hits Philippines playlist, all thanks to your incredible support!! We couldn't have done it without all of you ? Thank you for streaming!

Continue streaming here: sugarcane.lnk.to/leonora",,Photos,0,4/19/2023 20:00,2023,4,19,20:00:00,https://www.facebook.com/thesugarcaneph/posts/pfbid02jUy1KYkyVrA8YZZoTVhiKK5ZfTU7QRPynH4xvVN5wYwMgTuijVoGTE4XJ2r7Gh1Sl,FALSE,FALSE,NaN,2765,0,111,206,0,0,NaN
7.84235E+14,1E+14,SUGARCANE,"Magbago man lahat, pag-ibig ko'y tanging ikaw",,Text,0,4/20/2023 1:00,2023,4,20,1:00:00,https://www.facebook.com/thesugarcaneph/posts/pfbid0ZBv3ZYt9hBYE1ctDjQt6R7Uo22xm12H3vWkdfPsqRDvxDrZqVt95CpgqAKj86zXCl,FALSE,FALSE,NaN,2811,1,298,198,1,0,NaN
7.84245E+14,1E+14,SUGARCANE,Leonora - Official Guitar Chords,"Leonora - Official Guitar Chords

Dahil marami nagrerequest, ito na ang actual chords! ?
Watch the full video here: https://youtu.be/AQF2wFy8cVc",Videos,63,4/20/2023 4:00,2023,4,20,4:00:00,https://www.facebook.com/reel/676128150940845/,FALSE,FALSE,NaN,10356,9017,1059,470,7861,1070,NaN
7.8464E+14,1E+14,SUGARCANE,"Tamang games lang sa gedli 

u know what to do ??: sugarcane.lnk.to/leonora","Tamang games lang sa gedli 

u know what to do ??: sugarcane.lnk.to/leonora",Videos,21,4/20/2023 20:00,2023,4,20,20:00:00,https://www.facebook.com/reel/1555134251644193/,FALSE,FALSE,NaN,1494,1364,40,121,1167,192,NaN
7.84725E+14,1E+14,SUGARCANE,"?Di porket pinapakinggan mo ?Leonora?, Tiktok na music taste mo.

sugarcane.lnk.to/leonora","?Di porket pinapakinggan mo ?Leonora?, Tiktok na music taste mo.

sugarcane.lnk.to/leonora",Videos,15,4/21/2023 0:00,2023,4,21,0:00:00,https://www.facebook.com/reel/610180137677557/,FALSE,FALSE,NaN,2758,2144,211,117,1858,274,NaN
7.84846E+14,1E+14,SUGARCANE,"Thanks for sharing our music 
I listen to music everyday ??",,Photos,0,4/21/2023 5:37,2023,4,21,5:37:00,https://www.facebook.com/thesugarcaneph/posts/pfbid0G3ze6JgNSVYTXgmJPv1GqnTLSii4JD65R6gNHRfTir5Miyt45XwtYw48VSTxKa27l,FALSE,TRUE,NaN,2479,0,325,133,0,0,NaN
7.85023E+14,1E+14,SUGARCANE,Leonora - Official Instrumental,"Leonora - Official Instrumental
Watch the full video here: https://youtu.be/keG9p9k3Ff8

Wait namin mga covers niyo ha ?",Videos,65,4/21/2023 20:00,2023,4,21,20:00:00,https://www.facebook.com/reel/188305737350678/,FALSE,FALSE,NaN,22412,17173,1327,322,12886,4084,NaN
7.85032E+14,1E+14,SUGARCANE,Rob Deniel - Ang Pag-ibig (Cover),"Rob Deniel - Ang Pag-ibig (Cover)
""Pag-ibig mo lamang talaga"" ?

#sugarcanegardensessions ??",Videos,83,4/22/2023 0:00,2023,4,22,0:00:00,https://www.facebook.com/reel/1296983947520145/,FALSE,FALSE,NaN,22088,21320,1347,457,17459,3805,NaN
7.85338E+14,1E+14,SUGARCANE,"Good evening sa lahat sana masarap ulam niyo! Nasa Tiktok narin yung Official Instrumental, pwede niyo gamitin yung sound para magcover sa Tiktok ?? 

Tag niyo kami ha abangan namin! ??",,Links,0,4/22/2023 4:08,2023,4,22,4:08:00,https://www.facebook.com/thesugarcaneph/posts/pfbid02iXvaPQNZbe8q4DFx6pNB6EBHjzxjkzbgdjVfnUXipcipB3FKbS8gRxjsAH9nDP7xl,FALSE,FALSE,NaN,671,0,8,64,0,0,NaN
7.85384E+14,1E+14,SUGARCANE,Uy grabe! Thanks for using ?Leonora? for your school project ??,,Text,0,4/22/2023 6:00,2023,4,22,6:00:00,https://www.facebook.com/thesugarcaneph/posts/pfbid0yZrkjVSFJ3vKWQy6e9uQaAprQyHvf34zLBYNcoB63J6yEHncsejQLAJ1J6PDRMH9l,FALSE,FALSE,NaN,2490,4214,0,56,4214,0,NaN
7.85684E+14,1E+14,SUGARCANE,"sugarcane.lnk.to/leonora
sugarcane.lnk.to/leonora
sugarcane.lnk.to/leonora

Naka-stream na ba lahat? Iyak na kami pag hindi padin ??

#leonora #leonorabysugarcane #thesugarcaneph #OPM #sugarcane #fyp #fyp? #fypmusic #leonorrivera #joserizal #joserizzal #jrizz","sugarcane.lnk.to/leonora
sugarcane.lnk.to/leonora
sugarcane.lnk.to/leonora

Naka-stream na ba lahat? Iyak na kami pag hindi padin ??

#leonora #leonorabysugarcane #thesugarcaneph #OPM #sugarcane #fyp #fyp? #fypmusic #leonorrivera #joserizal #joserizzal #jrizz",Videos,23,4/22/2023 20:00,2023,4,22,20:00:00,https://www.facebook.com/reel/6338645759526086/,FALSE,FALSE,NaN,3917,2988,240,306,2596,350,NaN
7.8577E+14,1E+14,SUGARCANE,"sugarcane.lnk.to/leonora
sugarcane.lnk.to/leonora
sugarcane.lnk.to/leonora 

#sugarcane #Rizal #OPM #rizz #joserizal #leonorrivera #Leonora",,Photos,0,4/23/2023 0:00,2023,4,23,0:00:00,https://www.facebook.com/thesugarcaneph/posts/pfbid0avVq8CzaiqDawszR5JzD7iyKZq6kusF9scVsSsiAxfkNbyZjLQTJbiVgz63tVJPal,FALSE,FALSE,NaN,20947,122,9965,982,85,0,NaN
7.85845E+14,1E+14,SUGARCANE,"Kilalanin ang SUGARCANE

sugarcane.lnk.to/leonora

??: Louis Duran",,Photos,0,4/23/2023 3:30,2023,4,23,3:30:00,https://www.facebook.com/thesugarcaneph/posts/pfbid0fiYhBSBtBs8S2p5XuunoXVKcZmxqdYcttKg62YyYjUhSRv7Zw1H376t6xq9PaHUwl,FALSE,FALSE,NaN,6225,38,462,319,12,0,NaN
7.85998E+14,1E+14,SUGARCANE,"Leonora, but vocals only","Leonora, but vocals only

sugarcane.lnk.to/leonora
sugarcane.lnk.to/leonora
sugarcane.lnk.to/leonora",Videos,29,4/24/2023 4:00,2023,4,24,4:00:00,https://www.facebook.com/reel/2850799371716954/,FALSE,FALSE,NaN,4921,3723,513,229,3146,556,NaN
7.86207E+14,1E+14,SUGARCANE,"parang ang sarap bigla magpakasal ??

Credits: tiktok.com/@sanxxmiguel","parang ang sarap bigla magpakasal ??

Credits: tiktok.com/@sanxxmiguel",Videos,117,4/23/2023 20:00,2023,4,23,20:00:00,https://www.facebook.com/reel/3476104115998630/,FALSE,FALSE,NaN,5729,5782,451,339,4945,815,NaN
7.86262E+14,1E+14,SUGARCANE,"sugarcane.lnk.to/leonora
sugarcane.lnk.to/leonora
sugarcane.lnk.to/leonora

Salamat Klasik! ??",,Videos,0,4/23/2023 22:39,2023,4,23,22:39:00,https://www.facebook.com/thesugarcaneph/posts/pfbid02sdJLWrM8rWCroqsda16jU5yCbXKpZYtRQQmn3nhzm2QvgvVzTUNSP6ra9zJQt9Lhl,FALSE,TRUE,NaN,1620,1979,0,91,1967,0,NaN
7.86319E+14,1E+14,SUGARCANE,"Join us this Saturday, April 29, 2023, for Think Things Through Vol. 10 saGuijo Cafe + Bar Events! ??

With performances by SUGARCANE, Severo, MilesExperience, Nobrvnd, NOVAIiches, and Vanessa Mendoza. Show starts at 8pm. 

You can pre-order your tickets through the link: https://bit.ly/TTTVol10",,Photos,0,4/24/2023 1:30,2023,4,24,1:30:00,https://www.facebook.com/thesugarcaneph/posts/pfbid0FXk54AcoHGjYd8An3qDhLG99bUZR9CGdFjCNiT77v1u3Jn1QfE31GEKMxQk8pzjol,FALSE,FALSE,NaN,525,0,15,46,0,0,NaN
7.86399E+14,1E+14,SUGARCANE,"?Leonora? debuts at #190 on Spotify?s Top Songs PH Chart ??

Sobrang grabe suporta natatanggap namin mula sa inyo. Di kayang i-describe ng mga salita kung gaano kami kasaya ngayon ??

Continue streaming here ??
sugarcane.lnk.to/leonora
sugarcane.lnk.to/leonora
sugarcane.lnk.to/leonora",,Photos,0,4/24/2023 5:14,2023,4,24,5:14:00,https://www.facebook.com/thesugarcaneph/posts/pfbid02fotz2udaQZcJMxyUsafzEQTURXjZ9Nm8tWe4BC9Y7RNBiCv6yNk4DY2FgcF2bhuPl,FALSE,FALSE,NaN,2410,1,100,146,0,0,NaN
7.86716E+14,1E+14,SUGARCANE,"We made it! ?Kung Maging Akin Ka? reached #89 on Spotify?s Viral PH Chart! ?? All thanks to your support, grabe we love you so much ????

sugarcane.lnk.to/leonora
sugarcane.lnk.to/leonora
sugarcane.lnk.to/leonora","We made it! ?Kung Maging Akin Ka? reached #89 on Spotify?s Viral PH Chart! ?? All thanks to your support, grabe we love you so much ????

sugarcane.lnk.to/leonora
sugarcane.lnk.to/leonora
sugarcane.lnk.to/leonora",Videos,56,4/24/2023 20:00,2023,4,24,20:00:00,https://www.facebook.com/reel/763786461987706/,FALSE,FALSE,NaN,2339,1303,197,107,1094,204,NaN
7.86764E+14,1E+14,SUGARCANE,"HAHAHAHA ?di kami magbe-behave hanggang ?di niyo inii-stream! ??

sugarcane.lnk.to/leonora
sugarcane.lnk.to/leonora
sugarcane.lnk.to/leonora",,Photos,0,4/24/2023 22:30,2023,4,24,22:30:00,https://www.facebook.com/thesugarcaneph/posts/pfbid02WdApiJ2wpVVezPQ3Ls1ifED9nvzKsxZYxCUZHiCpoqjvSK875XfFokJKZgcy5Dg5l,FALSE,FALSE,NaN,3094,2,122,50,0,0,NaN
7.86768E+14,1E+14,SUGARCANE,"?Paruparo? joins ?Kung Maging Akin Ka? in Spotify?s Top Viral Hits Charts at #90 ??

Maraming salamat sa walang sawang suporta!!!

sugarcane.lnk.to/leonora
sugarcane.lnk.to/leonora
sugarcane.lnk.to/leonora",,Photos,0,4/24/2023 22:42,2023,4,24,22:42:00,https://www.facebook.com/thesugarcaneph/posts/pfbid05u2NdKPojzUNWqAoCuCg1ZXWN7TjeRcHmWQg86VLvF4uBAJUvfKtJNh7vX19peRJl,FALSE,FALSE,NaN,4811,0,298,140,0,0,NaN
7.87222E+14,1E+14,SUGARCANE,"Sa lungkot at ligaya, hirap at ginhawa, SUGARCANE makakasama mo

sugarcane.lnk.to/leonora
sugarcane.lnk.to/leonora
sugarcane.lnk.to/leonora

#sugarcane #Rizal #OPM #rizz #joserizal #leonorrivera #Leonora","Sa lungkot at ligaya, hirap at ginhawa, SUGARCANE makakasama mo

sugarcane.lnk.to/leonora
sugarcane.lnk.to/leonora
sugarcane.lnk.to/leonora

#sugarcane #Rizal #OPM #rizz #joserizal #leonorrivera #Leonora",Videos,60,4/25/2023 20:00,2023,4,25,20:00:00,https://www.facebook.com/reel/2163489183855379/,FALSE,FALSE,NaN,23727,12913,1775,196,11633,1256,NaN
7.87293E+14,1E+14,SUGARCANE,"Catch SUGARCANE, Dilaw, Lola Amour, Leanne & Naara, PLAYERTWO, JRLDM, and FELIP at We Play Here ??

Venue: Samsung Hall, SM Aura
Date: April 27, 2023
Doors open at 6PM

Grab your tickets here: weplayhere.helixpay.ph
#WePlayHere",,Photos,0,4/25/2023 23:39,2023,4,25,23:39:00,https://www.facebook.com/thesugarcaneph/posts/pfbid0xcNzGY2jgUacJSmWqKh1ZxeDtWyCoufXfgpsjKwdHTmPbLFvccDAU7qnnYeHZS3Ml,FALSE,FALSE,NaN,1049,0,47,48,0,0,NaN
7.87401E+14,1E+14,SUGARCANE,"?Leonora? debuts at #4 in Spotify?s Viral 50 Philippines ??

Ginalingan nyo naman masyado sa pag stream!! Labyu ol ??

EDIT: #3 na tayo!!! 

sugarcane.lnk.to/leonora
sugarcane.lnk.to/leonora
sugarcane.lnk.to/leonora

Edited by: Miss Khristine",,Photos,0,4/26/2023 4:52,2023,4,26,4:52:00,https://www.facebook.com/thesugarcaneph/posts/pfbid027JpcstnqfEcysh2GCNT4tDqPgdpRw8r4z5NgutcRVgTXwGUQMezLzDKKDDwxaXBDl,FALSE,FALSE,NaN,7137,1,368,273,1,0,NaN
7.87462E+14,1E+14,SUGARCANE,"Tara kaya? Gusto namin kayo makasama live! Dagdagan pa natin to! ??

??? For bookings and inquiries, message us at thesugarcaneph@gmail.com",,Photos,0,4/26/2023 7:00,2023,4,26,7:00:00,https://www.facebook.com/thesugarcaneph/posts/pfbid02CAoTqwspsYvuM9yoA86c6Y8pk1ZQCh6nEtSKtXN4tewiYhcWLEAuGCWUxSpYXunrl,FALSE,FALSE,NaN,1155,0,78,110,0,0,NaN
7.8776E+14,1E+14,SUGARCANE,04-28-23 ? 12 AM,,Photos,0,4/26/2023 21:00,2023,4,26,21:00:00,https://www.facebook.com/thesugarcaneph/posts/pfbid02P5Em6qBntzj3wK4Zv9TLGyaF5VFmkH9NGR2FuXTtUbWaZRUA8XidYrDM4wbsUg8El,FALSE,FALSE,NaN,2284,2,136,112,1,0,NaN
7.87972E+14,1E+14,SUGARCANE,???,,Photos,0,4/27/2023 6:58,2023,4,27,6:58:00,https://www.facebook.com/thesugarcaneph/posts/pfbid0qnGvGhFGKh2qjRmTCSJgZhZQCfnjU4esTBubjeqSffpxJsJc6rxadc1xhBotqDMAl,FALSE,TRUE,NaN,1075,0,20,51,0,0,NaN
7.88022E+14,1E+14,SUGARCANE,"????????????? ???????????????, ?????? ??????! ???????????? ????????:

sugarcane.lnk.to/PaalamLeonora
sugarcane.lnk.to/PaalamLeonora
sugarcane.lnk.to/PaalamLeonora

""Paalam, Leonora"" is a heart-wrenching and intimate acoustic rendition of the original song, ""Leonora"". It tells the tragic love story of Jose Rizal and his greatest love, Leonor Rivera, with a more sorrowful and introspective approach.

The stripped-down arrangement of ""Paalam, Leonora"" puts the focus on the emotional weight of the lyrics and the beautiful melody. The added exclusive ending/outro verse conveys a sense of acceptance of a love that was not meant to be, making the song even more poignant.

Credits:
Lyricist: Froilan Bautista
Composer: Cedric Angeles 
Recorded by: Cedric Angeles & Rene Serna of Spryta Recording Studio
Producer: Cedric Angeles
Mixing Engineer: Jorel Corpus
Mastering Engineer: Jett Galindo of The Bakery L.A.
Art by: Felix Gasmen

Warner Music Philippines: 
Sarah Ismail
Kelley Mangahas 
Rem Brofar 
Jam Rances
Nicole De Jesus
Neil Dimapilis 
Mika Ordo?ez
Joey Valverde
Patricia Paredes",,Photos,0,4/27/2023 9:00,2023,4,27,9:00:00,https://www.facebook.com/thesugarcaneph/posts/pfbid0JbY8G7KtfbW1psYoDcCitodxjhwDuc52GiJe7PibiHmA1a2iVfXdTH3zu4vLFMGVl,FALSE,FALSE,NaN,10198,15,754,243,10,0,NaN
7.88295E+14,1E+14,SUGARCANE,"????????????, ?????????????? (???????????????? ?????????? ????????????????????)

OUT NOW! WATCH HERE:
sugarcane.lnk.to/paalamleonora
sugarcane.lnk.to/paalamleonora
sugarcane.lnk.to/paalamleonora","????????????, ?????????????? (???????????????? ?????????? ????????????????????)

OUT NOW! WATCH HERE:
sugarcane.lnk.to/paalamleonora
sugarcane.lnk.to/paalamleonora
sugarcane.lnk.to/paalamleonora",Videos,33,4/27/2023 20:17,2023,4,27,20:17:00,https://www.facebook.com/reel/1271145220447610/,FALSE,FALSE,NaN,33916,27278,3083,489,22955,4013,NaN
7.88358E+14,1E+14,SUGARCANE,"sugarcane.lnk.to/paalamleonora
sugarcane.lnk.to/paalamleonora
sugarcane.lnk.to/paalamleonora

#paalamleonora #leonora #paalamleonorabysugarcane #leonorabysugarcane #thesugarcaneph #OPM #sugarcane #fyp #fyp? #fypmusic #leonorrivera #joserizal #joserizzal #jrizz",,Photos,0,4/27/2023 23:09,2023,4,27,23:09:00,https://www.facebook.com/thesugarcaneph/posts/pfbid048utGb5RsvG1VaEqaFfeFvG6bk5sgT6QVV9WJRCAwii8EcY9FMYShSn75L6o8YP8l,FALSE,FALSE,NaN,28076,286,15699,2377,244,0,NaN
7.88405E+14,1E+14,SUGARCANE,"sugarcane.lnk.to/paalamleonora

cnu rel8 dyan

credits: Joy Villamora",,Photos,0,4/28/2023 1:26,2023,4,28,1:26:00,https://www.facebook.com/thesugarcaneph/posts/pfbid08pxNGfm8HbktYsia2cvEoTonrPt1DQbWMU3suZLTfvA94kFt3yAYsnH6JmAtSzYMl,FALSE,FALSE,NaN,14714,93,4427,287,49,0,NaN
7.88483E+14,1E+14,SUGARCANE,"sugarcane.lnk.to/paalamleonora
sugarcane.lnk.to/paalamleonora
sugarcane.lnk.to/paalamleonora",,Photos,0,4/28/2023 5:03,2023,4,28,5:03:00,https://www.facebook.com/photo.php?fbid=788483389305342&set=a.228682271952126&type=3,FALSE,FALSE,NaN,2363,0,68,63,0,0,NaN
7.88587E+14,1E+14,SUGARCANE,wala na bang hahabol? https://bit.ly/TTTVol10,,Photos,0,4/28/2023 8:48,2023,4,28,8:48:00,https://www.facebook.com/thesugarcaneph/posts/pfbid01jVdbcRYvJe1p8V8Np3ba6Snj6toJWohF9piw7cbbyecsS1Tf7g43PeMgKCyiVzl,FALSE,TRUE,NaN,417,0,1,46,0,0,NaN
7.88826E+14,1E+14,SUGARCANE,"sugarcane.lnk.to/paalamleonora
sugarcane.lnk.to/paalamleonora
sugarcane.lnk.to/paalamleonora","sugarcane.lnk.to/paalamleonora
sugarcane.lnk.to/paalamleonora
sugarcane.lnk.to/paalamleonora",Videos,40,4/28/2023 20:00,2023,4,28,20:00:00,https://www.facebook.com/reel/3515116692056244/,FALSE,FALSE,NaN,79399,47243,7110,1034,41747,4872,NaN
7.88891E+14,1E+14,SUGARCANE,"sugarcane.lnk.to/paalamleonora

Another amazing artwork by our one and only song graphic artist, Felix Gasmen ????

More of his art on his IG: @artsbyfelix",,Photos,0,4/28/2023 23:00,2023,4,28,23:00:00,https://www.facebook.com/thesugarcaneph/posts/pfbid024AYqYQVtNTAKuXLX2HqWYE15Y2iFJczq3qzGYBheU3th4nTwgryGPx5p5o9uVZo6l,FALSE,FALSE,NaN,8274,2,537,84,2,0,NaN
7.88941E+14,1E+14,SUGARCANE,"hahahahah solid
credits: Nicz Cruz

sugarcane.lnk.to/paalamleonora
sugarcane.lnk.to/paalamleonora
sugarcane.lnk.to/paalamleonora",,Photos,0,4/29/2023 1:30,2023,4,29,1:30:00,https://www.facebook.com/thesugarcaneph/posts/pfbid06Y9yLzN5Yqd58kR3oTaQBxA3HV6ECkgnWahELXEgj3nLKA5Dvc4gZxLFBDANhMwRl,FALSE,FALSE,NaN,10683,9,601,82,4,0,NaN
7.88985E+14,1E+14,SUGARCANE,"?Leonora? hits 1M streams, a month from its release!! 

Maraming salamat, dabest kayo! Pakinggan niyo na rin ang bagong labas namin na ?Paalam, Leonora? ??

Art by: Felix Gasmen
Lay-out by: Rem Brofar

sugarcane.lnk.to/paalamleonora
sugarcane.lnk.to/paalamleonora
sugarcane.lnk.to/paalamleonora",,Photos,0,4/29/2023 3:30,2023,4,29,3:30:00,https://www.facebook.com/thesugarcaneph/posts/pfbid02YmtTsjwa2AMnNZccQr5S8RxvVPPGRCe91su7K2n1v3ZJtzdjb2Hz331oSYHzxQrZl,FALSE,FALSE,NaN,10831,43,499,332,40,0,NaN
7.89262E+14,1E+14,SUGARCANE,"STREAM HERE:
sugarcane.lnk.to/paalamleonora
sugarcane.lnk.to/paalamleonora
sugarcane.lnk.to/paalamleonora

#paalamleonora #leonora #paalamleonorabysugarcane #leonorabysugarcane #thesugarcaneph #OPM #leonorrivera #JoseRizal","STREAM HERE:
sugarcane.lnk.to/paalamleonora
sugarcane.lnk.to/paalamleonora
sugarcane.lnk.to/paalamleonora

#paalamleonora #leonora #paalamleonorabysugarcane #leonorabysugarcane #thesugarcaneph #OPM #leonorrivera #JoseRizal",Videos,83,4/29/2023 20:00,2023,4,29,20:00:00,https://www.facebook.com/reel/1282924182343285/,FALSE,FALSE,NaN,14248,10381,1131,188,8925,1352,NaN
7.89266E+14,1E+14,SUGARCANE,"What if nasa Wish Bus kami bukas sa People?s Park ? Valenzuela City, around 5:30PM? ??",,Photos,0,4/29/2023 22:30,2023,4,29,22:30:00,https://www.facebook.com/thesugarcaneph/posts/pfbid0c7jhphVhJjrtzYuuxJozyVZK8PF7uViGBdZGD7sc6jGzu7ut2KUaN5hD1wryoSzbl,FALSE,TRUE,NaN,3007,2,81,226,0,0,NaN
7.895E+14,1E+14,SUGARCANE,"Another school project! Nakakataba ng puso na nagagamit ang aming awitin sa mga ganitong klaseng proyekto ?? Salamat!!

sugarcane.lnk.to/leonora
sugarcane.lnk.to/leonora
sugarcane.lnk.to/leonora

#sugarcane #Rizal #OPM #rizz #joserizal #leonorrivera #Leonora",,Text,0,4/30/2023 0:00,2023,4,30,0:00:00,https://www.facebook.com/thesugarcaneph/posts/pfbid028E7gFZTksDjfTYP8eQufVzPt31FBoQCPeMhCUeANqHqcHLKZH7rZxEQfBxhR7yJjl,FALSE,FALSE,NaN,1382,2295,0,12,2294,0,NaN
7.89504E+14,1E+14,SUGARCANE,"Definitely one for the books! ??

Thank you Warner and We Play Here for having us! Hopefully sa susunod ulit ??

Photos by Chapters PH",,Photos,0,4/30/2023 4:00,2023,4,30,4:00:00,https://www.facebook.com/thesugarcaneph/posts/pfbid02nY72o3JKUQ2zARi6n5AFVZKbDwL7nRvWUKbYiBrjbQCuU8e8B6qxgMpUccooSqY9l,FALSE,FALSE,NaN,3425,3,187,81,1,0,NaN
7.89645E+14,1E+14,SUGARCANE,"?? SUGARCANE: #146 on Spotify?s Top PH artist chart 
?? Leonora: #2 on Spotify?s Viral PH songs chart
?? Leonora: #102 on Spotify?s Top PH songs chart

Maraming salamat!! Dabest talaga kayo ih ????

Continue streaming here:

sugarcane.lnk.to/paalamleonora
sugarcane.lnk.to/paalamleonora
sugarcane.lnk.to/paalamleonora",,Photos,0,4/30/2023 5:30,2023,4,30,5:30:00,https://www.facebook.com/thesugarcaneph/posts/pfbid02y4NTuYkwCjwdZLgBVqXeJ9LCdBKYAR9R7pX4MS3xS2kCXys2x9WWisFu87nWT9vRl,FALSE,FALSE,NaN,1978,1,93,112,0,0,NaN
7.89846E+14,1E+14,SUGARCANE,"Leonora (Flute Tutorial) ?? 
Watch on Youtube:
https://youtu.be/EQxz6zL9RFI

Stream here:
sugarcane.lnk.to/paalamleonora
sugarcane.lnk.to/paalamleonora
sugarcane.lnk.to/paalamleonora

#paalamleonora #leonora #paalamleonorabysugarcane #leonorabysugarcane #thesugarcaneph #OPM #leonorrivera #JoseRizal",,Links,0,4/30/2023 22:30,2023,4,30,22:30:00,https://www.facebook.com/thesugarcaneph/posts/pfbid0CnjUFr5qjZejes5CFdU8bsf9onBLnGcA2c51CfRdqfZjMYgfUZj6T4VvxLExHaeql,FALSE,FALSE,NaN,890,6,19,19,1,0,NaN
7.8985E+14,1E+14,SUGARCANE,"Kung Maging Akin Ka
#sugarcanegardensessions

Stream our latest single, ?Leonora?, here:
sugarcane.lnk.to/paalamleonora
sugarcane.lnk.to/paalamleonora
sugarcane.lnk.to/paalamleonora","Kung Maging Akin Ka
#sugarcanegardensessions

Stream our latest single, ?Leonora?, here:
sugarcane.lnk.to/paalamleonora
sugarcane.lnk.to/paalamleonora
sugarcane.lnk.to/paalamleonora",Videos,61,4/30/2023 20:00,2023,4,30,20:00:00,https://www.facebook.com/reel/623591782626866/,FALSE,FALSE,NaN,4480,3507,344,114,2891,600,NaN
7.89991E+14,1E+14,SUGARCANE,See you later!!! ??,,Photos,0,4/30/2023 20:05,2023,4,30,20:05:00,https://www.facebook.com/thesugarcaneph/posts/pfbid0cn51BqQbARNbb6jn9XFd7QQShiUB64CjyXHcCYjwxEYYqoh9Tk3JGpHNWsC49uU3l,FALSE,TRUE,NaN,1543,1,58,56,0,0,NaN
7.90104E+14,1E+14,SUGARCANE,"Big thanks to Chapters PH, and to the amazing people behind the music video of ""Leonora"". 

All the efforts given to this project truly paid off, and perfectly captured the essence of the song. ??

??: Louis Duran

Stream here:
sugarcane.lnk.to/paalamleonora
sugarcane.lnk.to/paalamleonora
sugarcane.lnk.to/paalamleonora",,Photos,0,5/1/2023 3:30,2023,5,1,3:30:00,https://www.facebook.com/thesugarcaneph/posts/pfbid023qL2AjfYymroW5xCBZhmqdZLSGJ8x7A6x2yizhX8z5oyci2DPwajJowRzV3ELWAcl,FALSE,FALSE,NaN,2811,3,103,61,2,0,NaN
7.90449E+14,1E+14,SUGARCANE,"sugarcane.lnk.to/leonora
sugarcane.lnk.to/leonora
sugarcane.lnk.to/leonora",,Photos,0,5/1/2023 20:30,2023,5,1,20:30:00,https://www.facebook.com/thesugarcaneph/posts/pfbid02WBHczGAMoHg3s4xApUftDXVrTFbudHjGTnSBgPemmjubHKj8CpuQTv79DQpNuppjl,FALSE,FALSE,NaN,1964,5,169,39,2,0,NaN
7.90708E+14,1E+14,SUGARCANE,Salamat sa mga pumunta last thursday! Grabe solid crowd ?? #WePlayHere,,Videos,0,5/1/2023 23:54,2023,5,1,23:54:00,https://www.facebook.com/thesugarcaneph/posts/pfbid02FqKpDaEMKTZZ1JkQTPtzVNZL6TSG8W43A51EnuHVtDvrBzHYe5VdLxCE15R2nZ75l,FALSE,TRUE,NaN,290,225,0,7,225,0,NaN
7.90742E+14,1E+14,SUGARCANE,"Wish Granted ?

Thanks Wish 107.5 for the photos",,Photos,0,5/2/2023 1:21,2023,5,2,1:21:00,https://www.facebook.com/thesugarcaneph/posts/pfbid0QVN71E1NdCU2ChmkT14xzL1mt3EsihY77y3RkwNQtF515gmKAvVAs8q6FveKtA2vl,FALSE,FALSE,NaN,6593,6,494,210,1,0,NaN
7.90793E+14,1E+14,SUGARCANE,"MV Reaction Video (Paalam, Leonora)

sugarcane.lnk.to/paalamleonora
sugarcane.lnk.to/paalamleonora
sugarcane.lnk.to/paalamleonora","MV Reaction Video (Paalam, Leonora)

sugarcane.lnk.to/paalamleonora
sugarcane.lnk.to/paalamleonora
sugarcane.lnk.to/paalamleonora",Videos,54,5/2/2023 3:28,2023,5,2,3:28:00,https://www.facebook.com/reel/759104699204855/,FALSE,FALSE,NaN,21373,34817,2071,642,32103,2400,NaN
7.90846E+14,1E+14,SUGARCANE,"sugarcane.lnk.to/paalamleonora
sugarcane.lnk.to/paalamleonora
sugarcane.lnk.to/paalamleonora",,Photos,0,5/2/2023 5:31,2023,5,2,5:31:00,https://www.facebook.com/photo.php?fbid=790845839069097&set=a.228682278618792&type=3,FALSE,FALSE,NaN,5275,0,85,106,0,0,NaN
7.91191E+14,1E+14,SUGARCANE,"Tag mo kung sigurado ka na sa kaniya ?? Or kung meron kang kaibigan or relative na dahilan kung bakit lumalaban ka parin, mention mo, wag ka mahiya. 'Di mo alam kung hanggang kailan mo siya makakasama, kaya iparamdam at sabihin mong mahal mo siya habang pwede pa.",,Photos,0,5/2/2023 20:30,2023,5,2,20:30:00,https://www.facebook.com/thesugarcaneph/posts/pfbid02hJVzbd8rc5APLH3kg5HzZMFHHaqKPA2StrthTme9ARdrjDhfCwaHvQC6i2R5ViPal,FALSE,FALSE,NaN,2047,3,138,81,0,0,NaN
7.91222E+14,1E+14,SUGARCANE,Tayo na sanang dalawa ??,,Videos,0,5/2/2023 21:52,2023,5,2,21:52:00,https://www.facebook.com/thesugarcaneph/posts/pfbid0hfoDiND54xCRzEdVnk6dVmZWsZ8SbTbXU57mzTNAUWnqu1Kh7LVZFGX2V7VYw8Xcl,FALSE,TRUE,NaN,1354,1325,0,24,1325,0,NaN
7.91327E+14,1E+14,SUGARCANE,"Stream here:
sugarcane.lnk.to/paalamleonora
sugarcane.lnk.to/paalamleonora
sugarcane.lnk.to/paalamleonora

Edit by: Hxste","Stream here:
sugarcane.lnk.to/paalamleonora
sugarcane.lnk.to/paalamleonora
sugarcane.lnk.to/paalamleonora

Edit by: Hxste",Videos,34,5/3/2023 3:00,2023,5,3,3:00:00,https://www.facebook.com/reel/222673437126348/,FALSE,FALSE,NaN,7711,6218,1327,283,5414,761,NaN
7.91768E+14,1E+14,SUGARCANE,"Uy di naman kami nananakit grabe kayo

Credits: Sugarcane Sweethearts",,Photos,0,5/3/2023 21:00,2023,5,3,21:00:00,https://www.facebook.com/thesugarcaneph/posts/pfbid02PdtgZRrQUtA4JZvGbtyCoApfghn4n5SNfUq6Er2Y5tsWwMpNXE9MxWw4sUn1J2xkl,FALSE,FALSE,NaN,5376,21,454,218,12,0,NaN
7.91877E+14,1E+14,SUGARCANE,"sugarcane.lnk.to/paalamleonora

made by: Amar Nasser",,Photos,0,5/4/2023 1:39,2023,5,4,1:39:00,https://www.facebook.com/thesugarcaneph/posts/pfbid02TeqUeV4arYRRKjiWMBjCXR1N6xA8ioxGgc2wkWeXii48uP8jHdzGAsEB7cUN3qEDl,FALSE,FALSE,NaN,9318,85,1502,82,58,0,NaN
7.91908E+14,1E+14,SUGARCANE,idol niyo pagod na,"sira yung mic

#SugarcaneGardenSessions",Videos,21,5/4/2023 2:43,2023,5,4,2:43:00,https://www.facebook.com/reel/1577292356093876/,FALSE,FALSE,NaN,4288,7125,311,275,6534,586,NaN
7.91943E+14,1E+14,SUGARCANE,Hi guys!! Sorry to inform you that Balcony Music House gig on May 13 is unfortunately cancelled. We?ll update our gig schedule and keep you posted immediately for upcoming gigs! ??,,Text,0,5/4/2023 4:04,2023,5,4,4:04:00,https://www.facebook.com/thesugarcaneph/posts/pfbid0T2uccGHzh9qXcxYqujGKNbgFFudhb1N7QABiYhT2Lh8L26KamjMnvwg7Mt8uDtNWl,FALSE,FALSE,NaN,1012,0,10,37,0,0,NaN
7.92036E+14,1E+14,SUGARCANE,"Throwback Wish Bus Experience

Thank you sa lahat ng pumunta ?? And goodluck sa band journey niyo KNDL!",,Videos,0,5/4/2023 6:56,2023,5,4,6:56:00,https://www.facebook.com/thesugarcaneph/posts/pfbid0JuLbf9M9zUFQMhnXAgpKxs77z5tDdsjbC7sdkgvAX5prfu8rLYby6mjw3y7ToWv4l,FALSE,TRUE,NaN,838,954,0,29,953,0,NaN
7.92425E+14,1E+14,SUGARCANE,"Nakakataba ng puso!! ?? 

Thank you so much Daniella, for this well-written spoken poetry. ?? 

sugarcane.lnk.to/paalamleonora
sugarcane.lnk.to/paalamleonora
sugarcane.lnk.to/paalamleonora",,Text,0,5/4/2023 23:23,2023,5,4,23:23:00,https://www.facebook.com/thesugarcaneph/posts/pfbid02QEWbUSTrwC6vGVW1GbHRD5Aq5Ebdom5AViRH7KjmApg9D3x4eQNgeAa6ww3yFBx1l,FALSE,FALSE,NaN,1131,1748,0,13,1741,0,NaN
7.92471E+14,1E+14,SUGARCANE,"Huge shoutout to these amazing people who made these artworks for us! 

Thank you, @Tabss.art & @Suphieyuh! ?",,Photos,0,5/5/2023 1:20,2023,5,5,1:20:00,https://www.facebook.com/thesugarcaneph/posts/pfbid02HKbpdgUJjBvbnVB75cEBvC9JhyaN9fPKJBrAtGJz8pXr3WdPsA8KPQoPvG93ZXN7l,FALSE,FALSE,NaN,1607,1,22,24,1,0,NaN
7.92519E+14,1E+14,SUGARCANE,"sugarcane.lnk.to/leonora
sugarcane.lnk.to/leonora
sugarcane.lnk.to/leonora

#sugarcane #Rizal #OPM #rizz #joserizal #leonorrivera #Leonora","sugarcane.lnk.to/leonora
sugarcane.lnk.to/leonora
sugarcane.lnk.to/leonora

#sugarcane #Rizal #OPM #rizz #joserizal #leonorrivera #Leonora",Videos,23,5/5/2023 3:30,2023,5,5,3:30:00,https://www.facebook.com/reel/754945062676076/,FALSE,FALSE,NaN,2602,1477,178,111,1228,233,NaN
7.92554E+14,1E+14,SUGARCANE,"See you tomorrow UST! 

Free entrance! (Exclusive for thomasians)",,Photos,0,5/5/2023 5:01,2023,5,5,5:01:00,https://www.facebook.com/thesugarcaneph/posts/pfbid07BPvt6jE8AJXduGFpwHSZHyDmKUvGYCeEmmTk16aHrMW24vKLH2dSr1bHJzx5udLl,FALSE,FALSE,NaN,2181,2,97,102,1,0,NaN
7.92937E+14,1E+14,SUGARCANE,"sugarcane.lnk.to/paalamleonora
sugarcane.lnk.to/paalamleonora
sugarcane.lnk.to/paalamleonora",,Photos,0,5/5/2023 19:44,2023,5,5,19:44:00,https://www.facebook.com/thesugarcaneph/posts/pfbid02cJSPsLZSrbynWPZMz4HqAm6Yh1akVLhBVPJFmD9kkkPj6MeWdREiye3os7qgRfmjl,FALSE,FALSE,NaN,5177,3,688,41,3,0,NaN
7.93011E+14,1E+14,SUGARCANE,Serenading kween ??,"Serenading kween ??

sugarcane.lnk.to/paalamleonora
sugarcane.lnk.to/paalamleonora
sugarcane.lnk.to/paalamleonora",Videos,17,5/6/2023 3:30,2023,5,6,3:30:00,https://www.facebook.com/reel/777044757206495/,FALSE,FALSE,NaN,3985,3162,347,171,2691,455,NaN
7.93569E+14,1E+14,SUGARCANE,"So good ???
sugarcane.lnk.to/leonora

Credits: @hezekiah.mesina (TikTok)","So good ???
sugarcane.lnk.to/leonora

Credits: @hezekiah.mesina (TikTok)",Videos,36,5/6/2023 22:30,2023,5,6,22:30:00,https://www.facebook.com/reel/5961637687267273/,FALSE,FALSE,NaN,19866,16614,1337,215,14666,1828,NaN
7.93686E+14,1E+14,SUGARCANE,"Nakapanood na ba lahat? ??

Watch Leonora (Official Music Video) on Youtube here: sugarcane.lnk.to/leonora","Nakapanood na ba lahat? ??

Watch Leonora (Official Music Video) on Youtube here: sugarcane.lnk.to/leonora",Videos,16,5/7/2023 3:44,2023,5,7,3:44:00,https://www.facebook.com/reel/793481405581590/,FALSE,FALSE,NaN,2829,1534,178,124,1206,271,NaN
7.94059E+14,1E+14,SUGARCANE,"Leonora Guitar Playthrough

sugarcane.lnk.to/leonora
sugarcane.lnk.to/leonora
sugarcane.lnk.to/leonora","Leonora Guitar Playthrough

sugarcane.lnk.to/leonora
sugarcane.lnk.to/leonora
sugarcane.lnk.to/leonora",Videos,42,5/7/2023 20:30,2023,5,7,20:30:00,https://www.facebook.com/reel/938579027465384/,FALSE,FALSE,NaN,17178,8501,1350,215,7548,881,NaN
7.94164E+14,1E+14,SUGARCANE,"Kung maging akin ka, ikaw ay liligaya ??
Stream here: sugarcane.lnk.to/kungmagingakinka",,Photos,0,5/8/2023 1:45,2023,5,8,1:45:00,https://www.facebook.com/thesugarcaneph/posts/pfbid07aDmtTU89rmU9QKFjB2p2L7MAWWdyeU3bix22GeXc7iWdt5hXKVrBu4W9PLzkV2nl,FALSE,FALSE,NaN,3614,56,520,128,43,0,NaN
7.94573E+14,1E+14,SUGARCANE,Thanks for this Warner Fam! ??,,Photos,0,5/8/2023 19:48,2023,5,8,19:48:00,https://www.facebook.com/thesugarcaneph/posts/pfbid0i4d69xb4wPXXCHsz8ocgnhZLsBEMP7Qt8k5HgJLpDa8JmmD7BHwDcVzGsB9BNir9l,FALSE,TRUE,NaN,1583,1,52,29,0,0,NaN
7.94654E+14,1E+14,SUGARCANE,Mahal pa rin kita challenge - SUGARCANE edition,Mahal pa rin kita challenge - SUGARCANE edition,Videos,166,5/8/2023 23:50,2023,5,8,23:50:00,https://www.facebook.com/reel/6057097687678714/,FALSE,FALSE,NaN,236788,629056,13265,9164,573900,55039,NaN
7.95144E+14,1E+14,SUGARCANE,"sugarcane.lnk.to/paalamleonora

Timelapse of the creation of ?Paalam, Leonora??s single art by Felix Gasmen ??

IG: @artsbyfelix","sugarcane.lnk.to/paalamleonora

Timelapse of the creation of ?Paalam, Leonora??s single art by Felix Gasmen ??

IG: @artsbyfelix",Videos,31,5/9/2023 20:38,2023,5,9,20:38:00,https://www.facebook.com/reel/160311973671171/,FALSE,FALSE,NaN,76118,38242,5736,331,33883,3831,NaN
7.95179E+14,1E+14,SUGARCANE,"Salamat UST!
?? CICS: Hack & Roll ? 05.06.23

??: Aliana Bengala",,Photos,0,5/9/2023 22:21,2023,5,9,22:21:00,https://www.facebook.com/thesugarcaneph/posts/pfbid0H9LSgcnZ43xnKga7DzB8yehpu4iN38ZykT5qavpwbUAUuHwMcghHW7pBmfNCz9fHl,FALSE,FALSE,NaN,2713,10,107,55,3,0,NaN
7.95217E+14,1E+14,SUGARCANE,"patugtog muna ng ?Paruparo? habang umuulan
sugarcane.lnk.to/paruparo",,Videos,0,5/10/2023 0:26,2023,5,10,0:26:00,https://www.facebook.com/thesugarcaneph/posts/pfbid02m2jgYuWcn6aXK31aEYXC2Jysuz88hJuYAQKQtzLp1NQXh8NHHyagD9hDRmiXivAil,FALSE,TRUE,NaN,986,1046,0,25,1038,0,NaN
7.95261E+14,1E+14,SUGARCANE,"Ginagalingan nyo masyado, kilig kami so much! maraming salamat ????

Stream here: sugarcane.lnk.to/leonora",,Photos,0,5/10/2023 2:33,2023,5,10,2:33:00,https://www.facebook.com/thesugarcaneph/posts/pfbid0NipKz9x6j5b5wq788uujaAYgYNyMySm6Yr81W9SB9zbBgnqsjn3reFyAfenTYK1bl,FALSE,FALSE,NaN,6919,1,273,192,1,0,NaN
7.95651E+14,1E+14,SUGARCANE,"Relate ka ba? Share mo naman sa comment section yan! ??

sugarcane.lnk.to/leonora","Relate ka ba? Share mo naman sa comment section yan! ??

sugarcane.lnk.to/leonora",Videos,29,5/10/2023 20:37,2023,5,10,20:37:00,https://www.facebook.com/reel/975397670564162/,FALSE,FALSE,NaN,2075,2072,218,105,1735,333,NaN
7.95684E+14,1E+14,SUGARCANE,??,,Photos,0,5/10/2023 22:25,2023,5,10,22:25:00,https://www.facebook.com/thesugarcaneph/posts/pfbid02P8Wm9gBvukrQUSEKHxucstxvYqnSuFPYdj9ChJdfCrHx5KboUZczCEc785bKugQQl,FALSE,TRUE,NaN,948,0,83,18,0,0,NaN
7.95811E+14,1E+14,SUGARCANE,"sugarcane.lnk.to/leonora
smooth ??

Tiktok: @mikeatsushi09","sugarcane.lnk.to/leonora
smooth ??

Tiktok: @mikeatsushi09",Videos,34,5/11/2023 4:33,2023,5,11,4:33:00,https://www.facebook.com/reel/1010449050136260/,FALSE,FALSE,NaN,2228,2046,132,62,1736,291,NaN
7.96139E+14,1E+14,SUGARCANE,"Mahal parin kita challenge part 2

stream our latest single here!
sugarcane.lnk.to/leonora

Instrumental by KaraoKeysPH","Mahal parin kita challenge part 2

stream our latest single here!
sugarcane.lnk.to/leonora

Instrumental by @[100075659364788:2048:KaraoKeysPH]",Videos,105,5/11/2023 19:14,2023,5,11,19:14:00,https://www.facebook.com/reel/729459938976001/,FALSE,FALSE,NaN,1554,2904,74,129,2434,465,NaN
